SECTOR;MES;TITULO;NARRATIVA;OPCION_A_TXT;OPCION_A_LOGIC;OPCION_B_TXT;OPCION_B_LOGIC;OPCION_C_TXT;OPCION_C_LOGIC;OPCION_D_TXT;OPCION_D_LOGIC
HOSTELERIA;15;Crisis de Personal;No encuentras camareros. Nadie quiere trabajar los fines de semana ni a turno partido. Tienes el equipo bajo mínimos y el servicio se resiente.;Ofrezco turno seguido, dos días libres consecutivos y sueldo por encima de convenio. Gano menos dinero yo, pero tengo al mejor equipo de la ciudad.;innovation 20 | empathy 15 | retention 10 | profit -10;Contrato a inmigrantes sin papeles o gente desesperada que acepte cualquier condición. Me aprovecho de la necesidad del mercado.;exploitation 25 | illegal 20 | risk 15 | ethics -20;"Salgo en la televisión quejándome de que ""la gente ya no quiere trabajar"" y ""las paguitas rompen España"". Victimismo público.";victimism 20 | blindness 15 | politics 10 | image -5;Robotizo la sala. Pongo códigos QR para pedir y pagar, y robots camareros para llevar platos. Elimino el factor humano lo máximo posible.;technology 20 | efficiency 15 | coldness 10 | adaptation 10
HOSTELERIA;16;La Cucaracha Chantajista;Un cliente empieza a gritar que hay una cucaracha en su ensalada. Tú sabes (porque has visto las cámaras o por intuición) que la ha puesto él para no pagar la cuenta de 100€.;Le invito a la comida y le pido perdón en voz baja para que se calle y no monte un escándalo que asuste a otros clientes. Cedo al chantaje por paz.;fear 20 | conflict_avoidance 15 | loss 10 | image 5;Saco el vídeo de la cámara de seguridad, se lo enseño en el móvil y le digo que pague o llamo a la policía por estafa. Tolerancia cero.;detective 25 | assertiveness 20 | justice 15 | conflict 10;"Le digo en voz alta que es mentira y que es una ""cebolla pochada"". Niego la realidad y le avergüenzo delante de todos. Contraataque.";arrogance 20 | denial 10 | aggression 10 | risk 10;Llamo a la policía directamente sin mediar palabra. Que se lo explique al agente. Escalo el conflicto al máximo nivel legal.;compliance 20 | escalation 15 | security 10 | time_loss 5
HOSTELERIA;17;El Socio Capitalista Pesado;Necesitas dinero para una reforma urgente. Un socio capitalista pone la pasta (100k) pero no tiene ni idea de hostelería y quiere opinar sobre la carta y la decoración.;Acepto el dinero y sus opiniones. Quien paga, manda. Si quiere poner cortinas feas, las pongo. Soy pragmático, necesito el cash.;submission 20 | money 15 | flexibility 10 | lack_of_taste 5;No acepto el dinero. Mi visión es intocable. Prefiero seguir con el local viejo a tener a un ignorante mandando en mi casa. Busco un banco.;autonomy 25 | integrity 20 | risk_propensity 5 | aesthetics 10;Le digo que sí a todo en la reunión, cojo el cheque, y luego hago lo que me da la gana en el día a día. Toreo al socio.;mischievous 25 | deceit 15 | control 10 | conflict_risk 15;Negocio un pacto de socios donde él lleva las finanzas y yo tengo veto absoluto en producto y operaciones. Roles blindados.;negotiation 20 | partnership 15 | structure 10 | balance 5
HOSTELERIA;18;Gestión de Sobras;Sobra mucha comida cocinada al final del día. Es comida buena, pero la ley dice que hay que tirarla o gestionarla con trazabilidad compleja.;La tiro toda a la basura. Cumplo la normativa de sanidad a rajatabla. No me la juego a una intoxicación o una multa. Duele, pero es lo correcto.;compliance 25 | caution 15 | waste 10 | safety 10;Se la doy al personal para que se la lleven a casa o se la coman allí. Es mi forma de complementar su sueldo y crear equipo.;generosity 20 | team_building 15 | rule_bending 5 | empathy 10;"La vendo en una App de ""Too Good To Go"" a bajo precio. Recupero el coste de materia prima y hago marketing verde.";business_acumen 20 | sustainability 15 | innovation 10 | profit 5;La saco por la puerta de atrás y se la doy a gente necesitada del barrio discretamente. Solidaridad directa y alegal.;altruism 25 | ethics 15 | risk 5 | humanity 10
HOSTELERIA;19;El Crítico Gastronómico;Entra por la puerta el crítico más temido de la ciudad. No te ha avisado. Si te pone bien, llenas un año. Si te pone mal, cierras.;Le trato como a uno más. Si somos buenos, lo verán. No voy a hacer el teatro ni a poner nervioso al equipo. Confío en mi estándar.;integrity 25 | confidence 20 | calm 15 | authenticity 10;Paro la cocina. El Chef cocina solo para él. El mejor camarero le atiende en exclusiva. Pánico total y foco absoluto en esa mesa.;perfectionism 25 | anxiety 20 | focus 15 | elitism 10;Le invito a todo, le saco platos fuera de carta y le hago la pelota descaradamente. Intento comprar su favor con trato VIP.;bribery 20 | insecurity 15 | pleaser 10 | artificial 5;Le digo al camarero que le trate con indiferencia o le escupa en la sopa (broma... o no). Odio a los críticos y su poder.;hostility 20 | resentment 15 | risk_propensity 25 | stupidity 10
HOSTELERIA;20;Incendio en la Cocina;Se quema la cocina un sábado noche. Nadie herido, pero la cocina está inutilizable por 1 mes. El seguro tardará en pagar. Tienes reservas para todo el mes.;"Alquilo una ""Dark Kitchen"" (cocina fantasma) mañana mismo y traslado la producción allí para seguir sirviendo o haciendo delivery. No paro.";resilience 25 | speed 20 | resourcefulness 15 | action 10;"Monto una barbacoa en la terraza y cambio el menú a ""Solo Brasa"" temporalmente. Convierto el desastre en un evento especial.";creativity 25 | adaptability 20 | marketing 10 | optimism 10;Cierro y despido a todos temporalmente (ERTE) hasta que el seguro pague y se arregle. Aprovecho para descansar. No lucho contra los elementos.;passivity 20 | caution 15 | rest 10 | detachment 5;Me hundo en la miseria y pienso que es el fin. Llamo a los clientes para cancelar llorando. Me dejo llevar por el drama.;defeat 20 | fragility 15 | emotion 10 | incompetence 5
HOSTELERIA;21;Deuda con el Banco;Debes 50.000€ de un préstamo ICO y no puedes pagar la cuota este mes. El banco te llama cada día. Si entras en mora, te bloquean las cuentas.;Voy al banco de frente antes de que venza. Les enseño los libros y renegocio una carencia. Doy la cara y busco aliados en el director.;proactive 25 | responsibility 20 | negotiation 15 | courage 10;"Dejo de pagar y no cojo el teléfono. ""De donde no hay no se puede sacar"". Ya pagaré cuando tenga, que me demanden si quieren.";avoidance 20 | irresponsibility 15 | risk_propensity 10 | stress 5;Pido dinero a un prestamista privado (intereses usureros) para pagar al banco. Tapo un agujero haciendo otro más grande y peligroso.;desperation 25 | risk_propensity 20 | stupidity 15 | fear 10;Vendo mi coche o mis joyas personales para pagar la cuota de la empresa. Me descapitalizo yo para salvar el negocio.;sacrifice 25 | commitment 20 | survival 15 | loyalty 10
HOSTELERIA;22;El Menú del Día;El menú del día te da muy poco margen pero trae gente al local. Estás trabajando gratis. ¿Qué haces?;Lo quito radicalmente. Quiero clientes de carta y calidad, no buscadores de ofertas. Si se vacía el local, que se vacíe, ya vendrán los buenos.;elitism 20 | profit 15 | risk_propensity 10 | bravery 5;Lo mantengo pero bajo la calidad de la materia prima al mínimo legal. Pollo industrial y arroz barato. Que coman lo que pagan.;greed 20 | short_term 15 | reputation_risk 10 | cynicism 5;"Lo subo de precio y lo convierto en ""Menú Ejecutivo"" de calidad. Filtro al cliente por precio pero le doy valor.";marketing 20 | strategy 15 | pivot 10 | smart 5;Lo mantengo como servicio público/gancho, asumiendo que no gano dinero con él, pero gano ambiente y venta cruzada de cafés/copas.;loss_leader 20 | volume 15 | hope 10 | marketing 5
HOSTELERIA;23;Amistad vs Negocio;"Tu mejor amigo viene siempre a cenar y nunca paga. ""Invita la casa"" dice él, o asume que tú invitas. Te está costando 300€ al mes su ""amistad"".";"Le cobro la próxima vez sin avisar. ""Los amigos son los primeros que deberían apoyar mi negocio pagando"". Si se enfada, no es amigo.";assertiveness 25 | business_focus 20 | boundaries 15 | clarity 10;Le sigo invitando. La amistad vale más que 300€. Lo considero un gasto de representación o social. Me da miedo perderle.;loyalty 20 | sentimental 15 | dependency 10 | financial_loss 5;Le digo que estoy en quiebra técnica (mentira) y que mis socios me auditan todo, para que pague por pena o por obligación externa.;deceit 15 | conflict_avoidance 15 | weakness 10 | excuse 5;Le cobro precio de coste o le hago un 50%. Busco un punto medio donde yo no pierda dinero y él tenga un trato especial.;negotiation 20 | compromise 15 | balance 10 | fairness 5
HOSTELERIA;24;El Plato Estrella Aburrido;Tu plato estrella (el que todos piden) te aburre cocinarlo, da poco margen y es antiguo. Quieres quitarlo para modernizar la carta, pero los clientes fijos se quejarán.;Lo quito. Soy el chef y yo decido qué cocino. Mi restaurante es mi expresión artística, no una fábrica de lo mismo. Renovarse o morir.;artist 25 | autonomy 20 | risk_propensity 15 | ego 10;Lo subo de precio brutalmente. Si lo quieren, que lo paguen bien. Así gano margen o dejan de pedirlo. Win-Win.;business_acumen 20 | smart 15 | profit 10 | cynic 5;Lo mantengo. Hay que dar al cliente lo que quiere, no lo que yo quiero. La humildad del tendero es servir a su público.;service 25 | humility 20 | boring 10 | stability 10;"Lo ""deconstruyo"" o modernizo. Mantengo la esencia pero cambio la forma para divertirme yo y no asustar al cliente.";creativity 20 | adaptation 15 | balance 10 | innovation 5
HOSTELERIA;25;Ruido Vecinal;Los vecinos se quejan del ruido de la terraza. Tienen razón, pero la terraza es el 50% de tu facturación. La policía viene cada fin de semana por las denuncias.;Insonorizo lo que pueda y pongo un vigilante para callar a los clientes. Quiero llevarme bien con el barrio y ser un negocio cívico.;civic 25 | responsibility 20 | peace 15 | cost 10;Paso de ellos. Pago las multas como un coste operativo más. Me sale rentable pagar multas y seguir facturando en la terraza.;mercenary 25 | conflict 20 | antisocial 15 | profit 10;Hablo con el presidente de la comunidad y le invito a cenar gratis a él y a su familia regularmente. Intento comprar su silencio con amabilidad.;diplomacy 20 | corruption 10 | relations 10 | astute 5;"Organizo una recogida de firmas de apoyo con los clientes y voy a los medios diciendo que ""los vecinos quieren destruir empleo"".";activism 20 | conflict 15 | mobilization 10 | pressure 5
HOSTELERIA;26;Socio Trabajador vs Vago;"Tu socio trabaja la mitad de horas que tú pero cobráis lo mismo a final de mes. Estás empezando a odiarle. Él dice que su trabajo es ""estratégico"".";Lo hablo hoy mismo. Reajustamos sueldos por horas trabajadas o rompemos la sociedad. La equidad es fundamental para no explotar.;justice 25 | communication 20 | fairness 15 | assertiveness 10;Me callo y acumulo rencor hasta estallar dentro de dos años. No quiero conflictos ahora que el negocio funciona.;passivity 20 | resentment 15 | conflict_avoidance 10 | bomb 5;Empiezo a trabajar menos yo también. Si él no curra, yo tampoco. Dejo que el negocio se hunda un poco para que reaccione.;immature 20 | equality 10 | decline 10 | passive_aggressive 10;Le ofrezco comprarle su parte. Prefiero endeudarme y ser dueño único que arrastrar un lastre. Corto por lo sano.;solution 25 | action 20 | ownership 15 | risk 10
HOSTELERIA;27;El Catering Imposible;Te piden un catering para una boda de 200 personas. Nunca has hecho uno tan grande. Es mucho dinero, pero si sale mal, te cargas la boda de alguien.;"Digo que sí y alquilo equipo, furgoneta y contrato extras. Es una aventura y una oportunidad de crecer. ""Se aprende haciendo"".";growth 25 | risk_propensity 20 | learning 15 | boldness 10;Digo que no. No es mi modelo de negocio y no quiero arriesgar mi reputación por dinero. Foco en lo que sé hacer.;focus 25 | discipline 20 | limitation 10 | honesty 10;Lo subcontrato a otra empresa de catering especializada y yo me llevo una comisión comercial sin decir nada a los novios.;broker 20 | smart 15 | delegation 10 | easy 5;Lo hago con los medios que tengo en el restaurante (pocos) para ahorrar costes. Probablemente salga un desastre, pero gano más margen.;optimism 20 | incompetence 15 | greed 10 | risk 15
HOSTELERIA;28;Guerra de Propinas;Hay mal rollo entre cocina y sala por el reparto de propinas. Los camareros dicen que son suyas, los cocineros dicen que sin comida no hay propina.;Establezco un sistema de puntos transparente y reparto entre todos (cocina y sala) por igual. Fomento el espíritu de equipo único.;equity 25 | team_building 20 | socialism 10 | fairness 10;Se las queda quien las recibe (sala). Es la ley de la selva y meritocracia comercial. Si cocina quiere propina, que salga a sonreír.;individualism 20 | competition 15 | unfairness 10 | sales_focus 5;Me las quedo yo (la empresa) para pagar roturas de vajilla y cenas de empresa. Soy el dueño y decido yo.;thief 20 | abuse 15 | toxic 10 | power 5;Elimino las propinas y subo los sueldos a todos. Profesionalizo el servicio y elimino la caridad del cliente.;culture 20 | innovation 15 | dignity 10 | cost 10
HOSTELERIA;29;El Proveedor Amigo;Tu proveedor de vinos es tu amigo de la infancia, pero sus precios son caros y el servicio es lento. Has encontrado otro mejor y más barato.;Cambio de proveedor. El negocio es el negocio y no es una ONG de amigos. Si quiere venderme, que mejore su oferta.;business 25 | cold_blood 20 | efficiency 15 | separation 10;"Le aprieto las tuercas enseñándole la oferta del otro. ""Igualamelo o te dejo"". Uso la competencia para que mi amigo espabile.";negotiation 20 | loyalty 10 | pressure 10 | opportunity 5;Sigo con él. La confianza y la lealtad se pagan. Sé que si tengo un problema un domingo, él vendrá. El otro no sé.;loyalty 25 | sentimental 15 | cost 10 | security 5;Le engaño diciendo que mi socio me obliga a cambiar, para no tener que decirle a la cara que le despido yo.;mischievous 20 | strategy 10 | lie 10 | avoidance 5
HOSTELERIA;30;La Obsesión Michelin;Te obsesionas con ganar una estrella Michelin. Empiezas a gastar dinero en vajilla cara y a complicar los platos. El restaurante deja de ser rentable en busca del premio.;Voy a por la estrella. Es mi sueño y mi realización personal. Si me arruino en el intento, al menos habré buscado la excelencia.;ambition 25 | risk_propensity 20 | perfectionism 15 | idealism 10;"Freno. ""Las estrellas no pagan facturas"". Vuelvo a la cocina honesta y rentable. Quiero un negocio, no un premio.";pragmatism 25 | profit 20 | realism 15 | grounding 10;Contrato a un asesor que sabe cómo ganar estrellas para que me diga los trucos. Hackeo el sistema con dinero.;investment 20 | strategy 15 | dependency 10 | short_cut 5;Cocino lo que me gusta a mí y me olvido de las guías. Si llega el premio bien, y si no, también. Busco mi propia satisfacción.;authenticity 25 | artistic 20 | calm 15 | independence 10
HOSTELERIA;31;La Niebla de Guerra;"El barrio cambia. Abren oficinas nuevas y cierran tiendas. No sabes si tu público cambiará de familias a ejecutivos. Tienes que decidir si reformas el local hacia ""menú rápido"" o ""cenas tranquilas"". Nadie tiene datos.";Apuesto por los ejecutivos y reformo para menú rápido. Me la juego a una carta basándome en mi olfato. Quien golpea primero, golpea dos veces.;intuition 20 | risk_propensity 15 | action 15 | leadership 10;No hago obras. Espero 6 meses a ver qué tipo de gente entra por la puerta. Me adapto a la demanda real, no a la imaginada.;prudence 20 | patience 15 | observation 10 | caution 5;Hago una reforma flexible (muebles móviles) que me permita ser rápido de día y elegante de noche. Intento cubrir todo, aunque sea más complejo.;adaptability 20 | innovativeness 15 | versatility 10 | complexity 5;Copio lo que ha hecho el bar de la esquina que parece que le va bien. Si a él le funciona, a mí también.;imitation 15 | security 10 | dependency 5 | vision -10
HOSTELERIA;32;Golpe Inesperado;Se rompe la cámara frigorífica principal cargada de género (3.000€ en comida) un viernes tarde. El técnico no viene hasta el lunes. Tienes reservas llenas.;Llamo a un camión frigorífico de alquiler de urgencia y salvo el género. Me cuesta dinero, pero salvo el fin de semana. Solución de bombero.;resourcefulness 25 | speed 20 | action 15 | cost 10;"Cocino todo lo que pueda hoy y hago ""Ofertas de derribo"" para venderlo todo ya. Convierto el problema en una fiesta de liquidación.";creativity 20 | sales 15 | adaptability 10 | loss_mitigation 10;Tiro la comida (o la dono si se puede) y compro al día lo justo para el servicio. Asumo la pérdida y reclamo al seguro. No me complico.;pragmatism 20 | detachment 15 | insurance 10 | simplicity 5;Me pongo a llorar y gritar de rabia en la cocina, bloqueando al equipo y creando un drama. Me supera la situación.;excitable 20 | fragility 15 | incompetence 10 | emotion 5
HOSTELERIA;33;La Soledad del Mando;Tienes que despedir a un empleado muy querido por todos porque roba botellas, pero no tienes pruebas físicas, solo tu certeza. Si le despides, el equipo se te echará encima. Estás solo con tu intuición.;"Le despido. Confío en mi criterio. Asumo el rol de ""malo"" temporalmente para proteger el negocio. No necesito que me entiendan, necesito que el barco flote.";autonomy 25 | conviction 20 | firmness 15 | loneliness 10;No le despido. Me da miedo quedarme solo contra el equipo. Espero a tener una prueba irrefutable (cámara) aunque me siga robando mientras.;fear 20 | affiliation 15 | caution 10 | delay 5;Le cuento a otro empleado de confianza mis sospechas para que me valide y me apoye. Busco aliados para no estar solo en la decisión.;politics 20 | alliance 15 | shared_responsibility 10 | insecurity 5;Le hago la vida imposible para que se vaya él solo. Guerra psicológica para no tener que mancharme las manos con un despido.;manipulation 20 | toxicity 15 | avoidance 10 | passive_aggressive 10
HOSTELERIA;34;El Caos Creativo;"Tu carta funciona, pero te aburre. Quieres introducir ""Tapas Fusión Asiático-Manchegas"". Es una locura que puede espantar a tu clientela clásica o traerte a un público nuevo y moderno.";"Lo hago. ""Quien no arriesga no gana"". Cambio la carta. Si perdemos a los viejos, vendrán los nuevos. Innovar es vivir.";innovativeness 25 | risk_propensity 20 | vision 15 | change 10;"No lo hago. ""Los experimentos con gaseosa"". Si el bar funciona, no se toca. Me aburro yo, pero la caja suena. Pragmatismo.";prudence 25 | stability 20 | conservation 15 | boredom 5;"Meto 3 platos nuevos como ""Sugerencias del Chef"" fuera de carta para probar. Testeo el mercado sin romper la estructura.";experimentation 20 | balance 15 | caution 10 | learning 5;Espero a ver si se pone de moda en el pueblo de al lado. Si veo que allí funciona, entonces lo copio.;imitation 15 | security 10 | lag 5 | fear 5
HOSTELERIA;35;La Meta Imposible;Te has propuesto doblar facturación este año para pagar la reforma. A mitad de año vas igual que el año pasado. Estás agotado de empujar y no ver resultados.;Sigo empujando. Reviso precios, horarios y turnos. No bajo la meta. El éxito es para los que resisten cuando duele.;tenacity 25 | achievement 20 | resilience 15 | effort 10;Bajo la meta y acepto que tardaré 3 años en pagar la reforma en vez de 1. Ajusto mis expectativas a la realidad para no frustrarme.;adaptability 20 | realism 15 | mental_health 10 | patience 5;"Culpo a la crisis, al clima o a las obras. ""No es culpa mía, es que no se puede"". Me instalo en la queja.";external_locus 20 | victimism 15 | passivity 10 | comfort 5;Busco un socio inversor que ponga dinero para pagar la reforma y me quite la presión de la deuda, aunque pierda acciones.;solution 20 | relief 15 | partnership 10 | dilution 5
HOSTELERIA;36;Información Incompleta;Te ofrecen comprar el local de al lado para ampliar. El precio es bueno, pero no sabes si el Ayuntamiento dará licencia de terraza. Tienes 24h para decidir o se lo venden a otro.;Lo compro. Es una oportunidad única. Si no dan licencia, ya se me ocurrirá algo (o sobornaré a alguien, o haré un almacén). Me la juego.;risk_propensity 25 | intuition 20 | decisiveness 15 | optimism 10;No compro. Sin certeza de licencia, el local no vale nada. No invierto a ciegas. Dejo pasar el tren.;prudence 25 | analysis 15 | safety 10 | regret 5;Pago una señal pequeña para reservar (opción de compra) condicionada a la licencia. Intento comprar tiempo con dinero.;negotiation 20 | strategy 15 | caution 10 | smart 5;Busco un contacto en el Ayuntamiento desesperadamente para que me filtre información extraoficial.;resourcefulness 20 | networking 15 | information 10 | haste 5
HOSTELERIA;37;Crítica Pública Viral;Un influencer local sube un vídeo diciendo que tu comida le sentó mal y acabó en el hospital. Es mentira (o no tienes constancia), pero el vídeo tiene 50k visitas y te insultan.;Grabo un vídeo respuesta enseñando mis facturas de compra y análisis de sanidad. Defiendo mi honor con datos y transparencia.;defense 25 | transparency 20 | courage 15 | facts 10;Me enfado muchísimo y le contesto insultándole en comentarios. Pierdo los papeles ante la injusticia.;excitable 25 | aggression 20 | emotional_stability -15 | mistake 10;No digo nada. Espero a que pase la tormenta. Internet olvida rápido. Cualquier respuesta es gasolina para el fuego.;stoicism 20 | patience 15 | wisdom 10 | pain 5;Le denuncio por difamación y daños al honor. Que se lo explique al juez. Judicializo el problema.;justice 20 | legal 15 | formality 10 | cost 5
HOSTELERIA;38;Burocracia vs Agilidad;Has abierto 3 locales. Ya no puedes estar en todos. Necesitas controlar. ¿Pones encargados con libertad o instalas cámaras y procesos rígidos para todo?;Libertad. Pongo encargados de confianza y les dejo hacer. Prefiero que se equivoquen a que sean robots. La hostelería es alma.;autonomy 25 | trust 20 | delegation 15 | risk 10;Control total. Cámaras, fichajes, escandallos milimétricos. Quiero saber dónde está cada céntimo. La confianza es buena, el control es mejor.;structure 25 | control 20 | distrust 10 | efficiency 15;Dejo que reine el caos y voy apagando fuegos yo mismo corriendo de un local a otro en moto. Soy el hombre orquesta.;chaos 20 | centralisation 15 | stress 10 | scalability -10;Copio el manual de operaciones de Burger King. Estandarizo todo para que cualquiera pueda trabajar. McDonaldización.;imitation 20 | systems 15 | scale 10 | soulless 5
HOSTELERIA;39;Esfuerzo sin Resultado;Tu equipo de cocina se ha currado un menú degustación nuevo increíble, pero nadie lo pide. Están frustrados. Quieren quitarlo.;Les digo que aguanten. El menú es bueno, el fallo es de marketing (mío). Voy a venderlo mejor. Valoro su esfuerzo y apuesto por él.;leadership 25 | responsibility 20 | persistence 15 | support 10;"Les felicito por el intento, pero lo quitamos. ""El mercado ha hablado"". No nos enamoramos de productos que no venden.";pragmatism 25 | flexibility 20 | detachment 15 | reality 10;"Les echo la bronca: ""Si fuera bueno, se vendería"". Transfiero mi frustración al equipo.";cruelty 20 | injustice 15 | morale -10 | blame 5;Bajo el precio a coste para que la gente lo pruebe y ellos se sientan realizados viendo salir platos, aunque no gane dinero.;empathy 20 | motivation 15 | profit -5 | heart 10
HOSTELERIA;40;Reinvención Personal;Llevas 20 años detrás de la barra. Te duelen las piernas y estás harto de borrachos. Pero es lo único que sabes hacer.;"Me formo en gestión y paso a ser ""Gerente"". Dejo la barra, contrato camareros y me dedico a los números. Evoluciono.";growth 25 | adaptability 20 | strategy 15 | professionalisation 10;Delego totalmente en un encargado y me convierto en inversor ausente. Voy solo a recoger la caja. Me jubilo en vida.;delegation 25 | trust 20 | freedom 15 | detachment 10;"Sigo en la barra quejándome todos los días. ""Es mi cruz"". Acepto mi destino de sufridor.";resignation 20 | stagnation 15 | victimism 10 | endurance 5;Vendo el bar. Cambio de vida radicalmente. Monto una ferretería o me voy al campo. Reinicio el sistema.;boldness 25 | change 20 | risk_propensity 15 | new_life 10
PYME;1;El Cliente Único;Tienes un cliente que supone el 80% de tu facturación. Te exige bajar precios un 20% o se va. Si aceptas, tu margen desaparece y trabajas gratis. Si te niegas, quiebras mañana.;Me niego y busco clientes nuevos como un loco esta semana. Prefiero morir de pie que vivir de rodillas. El miedo a perderle me ha paralizado demasiado tiempo.;risk_propensity 25 | courage 20 | sales 15 | autonomy 10;Acepto la bajada. Sobrevivir es lo primero. Ya reduciré costes por otro lado (despedir gente, peor calidad). Gano tiempo para pensar.;survival 25 | pragmatism 20 | submission 15 | pain 10;Negocio una bajada menor (10%) a cambio de más volumen o pronto pago. Intento salvar los muebles con mano izquierda.;negotiation 20 | balance 15 | diplomacy 10 | realism 5;Le miento diciendo que tengo otra oferta de un cliente grande para ver si se asusta y retira la amenaza. Farol (Bluff).;mischievous 20 | risk_propensity 15 | strategy 10 | deceit 5
