SECTOR;MES;TITULO;NARRATIVA;OPCION_A_TXT;OPCION_A_LOGIC;OPCION_B_TXT;OPCION_B_LOGIC;OPCION_C_TXT;OPCION_C_LOGIC;OPCION_D_TXT;OPCION_D_LOGIC
INTRA;16;El "Side Project";Tu contrato dice que la empresa es dueña de todo lo que inventes. Tienes una idea genial que no tiene que ver con tu trabajo.;Se la presento a la empresa para desarrollarla dentro (Intraemprendimiento).;loyalty 10 | institutional_trust 5 | risk_propensity -5 | naive 2;La desarrollo en secreto las noches y fines de semana y me voy cuando esté lista.;mischievous 10 | autonomy 5 | risk_propensity 5 | betrayal 2;No hago nada. No quiero líos legales con mi empleador.;cautious 10 | fear 5 | stagnation 5;Pido una modificación de mi contrato a RRHH (se reirán de ti).;diligent 5 | negotiation 5 | transparency 5
INTRA;17;Compras y Burocracia;Necesitas comprar una licencia de software de 50€. El proceso de "Alta de Proveedor" tarda 2 meses y pide 14 documentos.;La pago yo con mi tarjeta y paso un ticket de "Comida de empresa" (falso) para que me lo devuelvan.;mischievous 10 | efficiency 5 | ethics -5 | survival 5;La pago yo y no la cobro. Regalo 50€ a la empresa por agilidad. Estoy harto.;self_sacrifice 5 | autonomy 5 | frustration 5 | generous 5;Espero los 2 meses. El proceso es el proceso y hay que respetarlo.;diligent 10 | dependent 5 | patience 5 | slow 5;Busco una versión pirata o una demo gratuita para salir del paso.;resourcefulness 5 | cheap 5 | security_risk 5
INTRA;18;El Padrino Caído;El directivo que protegía tu proyecto y te daba presupuesto ha sido despedido. Estás solo ante los lobos.;Busco rápidamente un nuevo padrino político vendiéndole el proyecto como "suyo".;political_savvy 10 | adaptability 5 | survival 5 | chameleon 5;Me escondo e intento pasar desapercibido hasta que escampe la tormenta.;cautious 5 | fear 5 | passive 5;Presento mi dimisión. Sin apoyo político, esto está muerto y yo también.;pessimism 5 | impulse 5 | surrender 5;Sigo trabajando igual, confiando en que "los buenos resultados me protejan". (Iluso).;naive 10 | diligent 5 | focus 5 | blindness 5
INTRA;19;Reuniolitis;Te pasan el día en reuniones de "alineamiento", "synergies" y "status report". No tienes tiempo de trabajar.;Empiezo a declinar reuniones masivamente sin dar explicaciones. "Ghosting corporativo".;autonomy 5 | assertiveness 10 | risk_propensity 5 | productivity 5;Voy a las reuniones pero trabajo con el portátil abierto en otra cosa sin escuchar.;passive_aggressive 5 | multitasking 5 | disrespect 2;Propongo una política oficial de "No reuniones los viernes" a RRHH.;culture 5 | innovativeness 2 | systemic 5;Me quedo cada día hasta las 20:00 para trabajar cuando todos se han ido.;diligent 5 | burnout 10 | submission 5
INTRA;20;La Imagen Corporativa;Lanzas una versión Beta (MVP). Un cliente importante se queja de que "tiene fallos y da mala imagen a la corporación". El CEO te llama enfadado.;Le explico que es una Beta para aprender. "El fallo es parte del proceso". Pedagogía.;educational 5 | resilience 5 | communication 5 | courage 5;Retiro el producto inmediatamente pidiendo mil perdones. Pánico.;fear 5 | dependent 5 | submission 5;Le echo la culpa al proveedor tecnológico externo. "Son unos inútiles".;mischievous 5 | defense 5 | cowardice 5;Le ignoro. "Ese cliente es un dinosaurio, no es nuestro target".;arrogant 5 | focus 5 | risk_propensity 5
INTRA;21;Use it or Lose it;Es 15 de diciembre. Te sobran 20.000€ de presupuesto. Si no los gastas, te los quitan el año que viene.;Me los gasto en equipos Apple y formación cara innecesaria para el equipo. "Derroche táctico".;waste 5 | system_gaming 10 | team_building 5;Los devuelvo. Ser honesto ahorra dinero a la compañía y es lo correcto.;integrity 10 | naive 5 | company_man 5 | budget_cut 5;Adelanto pagos a proveedores del año que viene (Pre-pago). Ingeniería financiera.;astute 5 | planning 5 | efficiency 5;Contrato a la consultora de un amigo para que haga un "estudio de mercado" fantasma.;mischievous 10 | corruption 5 | friendship 5
INTRA;22;Democracia vs Jerarquía;En la reunión de brainstorming, un becario tiene una idea genial que contradice al Director General.;Fomento el debate y apoyo al becario. "Aquí gana la mejor idea, no el cargo".;innovativeness 5 | democracy 10 | brave 5 | conflict 5;Le hago una señal al becario para que se calle. No quiero que le despidan (ni a mí).;political_savvy 5 | cautious 5 | hierarchy 5 | protection 5;Hago reuniones separadas: una creativa (equipo) y una política (jefes) para filtrar.;diplomacy 5 | cunning 5 | bridge 5;Tomo la idea del becario y la presento yo suavizada para que el Director la acepte.;protection 5 | leadership 5 | translation 5
INTRA;23;El Éxito Mata;Tu proyecto ha crecido tanto que RRHH quiere imponer sus procesos estándar (evaluaciones, horarios, bonus). Matarán tu cultura ágil.;Lucho a muerte por mantener mi "Isla de Libertad" con normas propias. Independencia o muerte.;autonomy 10 | rebellion 5 | conflict 5 | culture 5;Acepto. Es el precio de escalar. Hay que madurar y ser una unidad de negocio real.;maturity 5 | adaptation 5 | corporate 5 | boring 5;Negocio una integración lenta (1 año) para "no romper el juguete".;negotiation 5 | patience 5 | delay 5;Me voy a montar otra cosa pequeña. Me aburre la gestión y la burocracia.;innovativeness 5 | impatience 10 | starter 5
INTRA;24;Envidia Salarial;Para tu proyecto de IA, contratas a un experto externo que cobra más que tú y que tu propio jefe. Se filtra el sueldo. Hay rebelión a bordo.;Defiendo el mercado: "Si queremos talento Champions, hay que pagarlo". Realismo duro.;pragmatism 10 | achievement 5 | brave 5 | fairness 5;Intento ocultarlo o mentir sobre su sueldo real (decir que incluye bonus variables).;mischievous 5 | secrecy 5 | conflict_avoidance 5;Pido una subida para mí también por "agravio comparativo". Aprovecho la ola.;mercenary 5 | ego 5 | negotiation 5;Le digo que es un "consultor mercenario" y que nosotros tenemos "estabilidad".;astute 5 | deceit 2 | culture_defense 5
INTRA;25;Síndrome "Not Invented Here";Propones colaborar con una Startup externa para ir rápido. Tu equipo técnico interno se niega: "Su código es basura, nosotros lo hacemos mejor (en 2 años)".;Fuerzo la colaboración. Necesitamos velocidad, no código perfecto ni egos de ingenieros.;achievement 5 | speed 10 | authority 5 | conflict 5;Les dejo hacerlo internamente para mantener la paz y la motivación, aunque tardemos.;trust 5 | quality 5 | slow 5 | team_building 5;Hago una prueba ciega (Benchmark) para comparar resultados y callar bocas.;data_driven 5 | objective 5 | fairness 5;Contrato a la startup en secreto para que haga el prototipo y luego se lo doy a los míos.;mischievous 10 | risk_propensity 5 | manipulation 5
INTRA;26;El Spin-off (Salida);La empresa quiere separar tu proyecto y crear una filial independiente. Te ofrecen ser CEO pero bajándote el sueldo fijo un 40% a cambio de acciones (riesgo).;Acepto. Es mi sueño: ser empresario pero con el respaldo de la nave nodriza.;risk_propensity 10 | achievement 5 | autonomy 5 | ambition 5;Rechazo. Tengo hipoteca y niños. Prefiero mi sueldo seguro y mi antigüedad.;cautious 10 | comfort 5 | dependent 5 | stability 5;Pido mantener tu sueldo anterior garantizado 2 años. "Riesgo controlado".;negotiation 5 | aversion_loss 5 | smart 5;Pido acciones pero sin dejar de ser empleado de la matriz. Lo mejor de los dos mundos.;astute 5 | greedy 5 | security 5
INTRA;27;Fiesta del Fracaso;Un experimento ha salido mal y se han perdido 50.000€. Tienes que hacer el informe de cierre (Post-Mortem).;Hago una "Fuck-up Night" con cervezas para celebrar lo aprendido y que no se repita.;innovativeness 5 | psychological_safety 10 | brave 5 | culture 5;Escribo un informe técnico aburrido y lo entierro en la intranet donde nadie lo lea.;diligent 5 | hiding 5 | shame 5 | bureaucracy 5;Busco un chivo expiatorio externo (el mercado, la agencia) para salvar mi culo.;mischievous 5 | defense 5 | politics 5 | blame 5;Digo que no fue un fallo, sino un "Pivot estratégico". Marketing puro.;marketing 5 | spin 5 | denial 5
INTRA;28;Sostenibilidad de Postureo;Te piden que tu proyecto sea "Verde". Hacerlo real sube el coste un 20% y retrasa el lanzamiento. Hacerlo "de marketing" es gratis.;Lo hago verde de verdad. El futuro es sostenible o no será. Asumo el coste.;integrity 10 | vision 5 | patience 5 | ethics 5;Hago "Greenwashing": pinto el logo de verde y dono 100€ a un bosque. Cumplo el expediente.;mischievous 5 | superficial 5 | speed 5 | cynicism 5;Ignoro la petición. "El cliente quiere precio, no árboles".;arrogant 5 | risk_propensity 5 | focus 5 | business_sense 5;Busco una subvención europea que cubra ese sobrecoste. Burocracia útil.;resourcefulness 5 | astute 5 | patience 5
INTRA;29;Horas Extra;Lanzamiento. Tu equipo lleva 3 semanas saliendo a las 22:00. La empresa no paga horas extra.;Les doy días libres "extraoficiales" (bajo cuerda) cuando acabe el proyecto. "No se lo digáis a RRHH".;empathy 5 | mischievous 5 | justice 10 | team_building 5;Les invito a cenar pizzas con mi propio dinero. Gesto simbólico.;generosity 5 | leadership 5 | sympathy 5;Les doy las gracias en público y apelo al "orgullo de pertenencia". (Barato).;manipulation 5 | cheap 5 | motivation 2;Peleo con RRHH hasta conseguir un bonus excepcional, aunque me marque como "problemático".;persistence 5 | loyalty 10 | brave 5
INTRA;30;Vuelta a la Casilla de Salida;Tu proyecto innovador se cancela por cambio de estrategia global. Te ofrecen volver a tu antiguo puesto operativo gris.;Vuelvo. Hace mucho frío fuera de la empresa. Tengo hipoteca.;cautious 10 | humility 5 | resilience 5 | security 5;Me voy de la empresa. Ya he probado la sangre emprendedora y no puedo volver atrás.;risk_propensity 10 | ambition 5 | autonomy 5 | courage 5;Negocio un despido pactado (el paro) para tener tiempo de pensar mi siguiente paso.;astute 5 | planning 5 | freedom 5;Me quedo pero hago "Quiet Quitting" (mínimo esfuerzo) mientras busco otra cosa.;passive_aggressive 5 | resentment 5 | disengagement 5
AUTOEMPLEO;1;La Boda del Primo;Tu primo se casa. Te dice: "Tú que tienes esa cámara tan buena (que te costó 4.000€), haznos las fotos. Te invitamos al cubierto y te damos visibilidad".;Les digo que mi tarifa son 1.500€, pero les hago un 20% de descuento por familia. El equipo se amortiza cobrando.;assertiveness 10 | achievement 5 | emotional_stability 5 | family_conflict 5;Acepto gratis. Es familia. Me paso 10 horas trabajando mientras los demás beben y comen.;dependent 10 | exploitation 5 | professional -5 | resentment 5;Les digo que voy de invitado, sin cámara. "Si llevo la cámara, estoy trabajando, no celebrando".;boundaries 10 | autonomy 5 | self_care 5 | firmness 5;Les cobro solo los costes de edición y álbum, pero no mi mano de obra del día.;negotiation 5 | compromise 5 | undervaluation 5
AUTOEMPLEO;2;La Gripe del Autónomo;Martes. Tienes una entrega urgente mañana. Tienes 39º de fiebre y escalofríos. No hay nadie que te cubra.;Me atiborro a paracetamol, trabajo temblando y entrego. "El autónomo no tiene derecho a enfermar".;achievement 5 | self_destruction 5 | resilience 5 | health -5;Llamo al cliente, le digo la verdad y pido 24h extra. Soy humano, no un robot.;emotional_stability 5 | honesty 5 | self_care 5 | assertiveness 5;Entrego lo que tengo hecho (70%) avisando de que faltan retoques. Salir del paso.;cautious 5 | perfectionism -5 | crisis_mgmt 5;Subcontrato a un colega de confianza para que lo termine y le pago yo. Pierdo dinero, cumplo palabra.;resourcefulness 5 | delegation 5 | profit -5 | professionalism 5
AUTOEMPLEO;3;El Cliente "Ya que estás";Te han contratado para diseñar un logo. El cliente te dice: "Oye, ya que estás, cámbiame también la foto de portada del Facebook y el color de la web. Son 5 minutos".;Lo hago gratis. No quiero discutir por pequeñeces y quiero que me vuelva a llamar.;dependent 5 | conflict_aversion 5 | weakness 5 | profitability -5;Le digo: "Claro, te paso presupuesto para esos extras y nos ponemos". Nada es gratis.;assertiveness 10 | business_sense 5 | boundaries 5 | respect 5;Le digo que no. Me ciño al contrato estrictamente. "Eso no estaba en el presupuesto".;rigid 5 | conflict 5 | autonomy 5;Lo hago de mala gana y rápido para quitármelo de encima.;passive_aggressive 5 | quality -5 | resentment 5
AUTOEMPLEO;4;El Falso Autónomo;Una empresa te ofrece trabajar para ellos: 8 horas al día, en su oficina, con su horario... pero facturándoles como autónomo (te ahorran la SS). Son 1.800€/mes seguros.;Acepto. Necesito la seguridad de los 1.800€ aunque sea un fraude laboral y pierda libertad.;security 10 | autonomy -10 | risk_propensity -5 | dependency 5;Rechazo. "Si queréis horario, me hacéis contrato. Si soy autónomo, trabajo desde mi casa y a mi ritmo".;autonomy 10 | integrity 5 | risk_propensity 5 | bravery 5;Acepto temporalmente mientras busco otros clientes para no depender solo de ellos.;astute 5 | survival 5 | strategy 5;Les denuncio a Inspección de Trabajo. Están precarizando el sector.;justice 10 | aggression 5 | bridge_burning 5
AUTOEMPLEO;5;Enero: El Desierto;Acaba la campaña de Navidad. En enero no entra ni un email. Tienes ahorros para 2 meses. El silencio te asusta.;Entro en pánico y bajo mis precios a la mitad en Instagram para captar lo que sea. Desesperación.;anxiety 5 | price_war 5 | risk_propensity 2 | value -5;Aprovecho para descansar, actualizar el portfolio y formarme. Es el ciclo natural, ya vendrá trabajo.;emotional_stability 10 | planning 5 | confidence 5 | patience 5;Me busco un trabajo temporal de camarero fines de semana para tener cash flow.;pragmatism 5 | humility 5 | survival 5;Empiezo a escribir a puerta fría a antiguos clientes. Acción comercial agresiva.;achievement 5 | sales 5 | proactivity 5
AUTOEMPLEO;6;La Pesadilla del IVA;Llega el trimestre. Te sale a pagar 2.000€ de IVA. Te has gastado ese dinero en una lente nueva porque "pensabas que te sobraba".;Pido un aplazamiento a Hacienda. Pago intereses, pero no me ahogo hoy.;cautious 5 | financial_mgmt -5 | pragmatism 5;Tiro de tarjeta de crédito para pagar los impuestos. Bola de nieve de deuda.;risk_propensity 5 | bad_planning 5 | anxiety 5;Vendo la lente nueva en Wallapop perdiendo dinero para pagar la deuda. Lección aprendida.;responsibility 5 | sacrifice 5 | asset_loss 5;No presento el trimestre y espero a que me reclamen. (Suicidio fiscal).;mischievous 5 | irresponsibility 10 | risk_propensity 10
AUTOEMPLEO;7;El Sobrino con Photoshop;Pasas un presupuesto de 800€. El cliente te dice: "Uf, mi sobrino me lo hace por 50€ con una App del móvil".;Le digo: "Pues que te lo haga tu sobrino". Y me voy con la cabeza alta. No compito con amateurs.;arrogant 5 | dignity 10 | self_efficacy 5 | risk_propensity 5;Intento educarle sobre la diferencia de calidad, luz, composición... Justifico mi precio.;pedagogy 5 | patience 5 | sales 2;Le bajo el precio a 400€ para no perder el trabajo. Me humillo a medias.;fear 5 | negotiation -5 | weakness 5;Le digo: "Cuando tu sobrino lo haga mal, llámame y lo arreglamos por 1.000€".;astute 5 | passive_aggressive 5 | confidence 5
AUTOEMPLEO;8;Vacaciones en la Playa;Estás en la playa, primera vez en un año. Te llama un cliente pesado: "Es una urgencia, necesito el archivo ya". Tienes el portátil en el hotel.;Le digo que estoy de vacaciones y que vuelvo en una semana. El mundo no se acaba.;boundaries 10 | mental_health 5 | assertiveness 5 | risk_propensity 2;Subo al hotel corriendo, lo envío y bajo a la playa enfadado. No desconecto nunca.;dependent 5 | anxiety 5 | boundaries -5 | workaholic 5;No cojo el teléfono. Tengo el móvil apagado o en modo avión. Desconexión total.;autonomy 5 | freedom 5 | peace 5;Le cobro un "Plus de Urgencia en Vacaciones" de 100€. Si paga, trabajo.;mercenary 5 | business_sense 5 | negotiation 5
AUTOEMPLEO;9;El Precio Hora;Tardas 1 hora en hacer el trabajo porque llevas 10 años aprendiendo. El cliente dice: "¿100€ por una hora? ¡Es un robo!";Le explico la historia del Picasso: "No cobro por apretar el botón, cobro por saber qué botón apretar".;assertiveness 5 | communication 5 | value 5;Le miento y le digo que en realidad me lleva 5 horas de "procesado invisible".;mischievous 5 | insecurity 5 | deception 2;Me siento mal y le bajo el precio. Síndrome del impostor.;insecurity 10 | emotional_stability -5 | value -5;Le paso una factura desglosada con costes de equipo, software, autónomos, etc.;rational 5 | education 5 | transparency 5
AUTOEMPLEO;10;La Soledad del Corredor;Llevas 3 días sin salir de casa y sin hablar con nadie en persona. Empiezas a hablarle a las plantas.;Me apunto a un Coworking aunque me cueste 150€. Necesito ver gente y separar espacios.;social_needs 10 | mental_health 5 | cost 5 | networking 5;Me bajo a la cafetería a trabajar con los auriculares. Ruido blanco y café.;resourcefulness 5 | social 2 | change 5;Sigo en casa. Ahorro dinero y me concentro mejor. Soy un lobo solitario.;introversion 5 | savings 5 | isolation 5;Quedo con amigos para cenar, pero les doy la chapa hablando de trabajo toda la noche.;obsession 5 | social_skills -2 | relief 5
AUTOEMPLEO;11;El Equipo Muere;Tu cámara/ordenador principal muere. Repararlo cuesta 800€ y tarda 2 semanas. Tienes boda el sábado.;Alquilo equipo profesional para el fin de semana. Coste alto, pero salvo el trabajo.;problem_solving 10 | responsibility 5 | profit -5;Compro uno nuevo a plazos. Inversión forzosa.;investment 5 | risk_propensity 2 | renewal 5;Voy con el equipo viejo de repuesto (que es malo). Rezo para que salgan bien.;cautious 5 | risk_propensity 5 | quality -5;Pido prestado equipo a un colega a cambio de cubrirle yo otro día.;networking 5 | collaboration 5 | resourcefulness 5
AUTOEMPLEO;12;Redes Sociales vs Trabajo;Te pasas 3 horas al día haciendo Reels y Stories para "tener presencia", pero apenas editas fotos.;Contrato un asistente virtual o herramienta para programar redes. Recupero mi tiempo.;delegation 5 | efficiency 5 | cost 2;Dejo las redes. "Mi trabajo habla por mí". El boca a boca es mejor que el algoritmo.;autonomy 5 | focus 10 | traditional 5 | marketing -5;Sigo haciéndolo. Es parte del trabajo hoy en día, soy mi propio Community Manager.;adaptability 5 | discipline 5 | time_loss 2;Hago fotos mediocres pero Reels virales. Me convierto en Influencer, no fotógrafo.;pivot 5 | superficial 5 | fame 5
AUTOEMPLEO;13;El Adelanto (Provisión de Fondos);Cliente nuevo te encarga un proyecto grande. ¿Pides dinero por adelantado?;Siempre. 50% por adelantado, 50% a la entrega. Si no fían, yo tampoco.;cautious 10 | business_sense 5 | security 5;No pido nada para no asustarles. Cobro al final (si pagan).;dependent 5 | risk_propensity 5 | fear 5;Pido un 20% para "reserva de fecha". Compromiso mínimo.;negotiation 5 | balance 5;Firmo un contrato blindado, pero no pido dinero hasta entregar.;legal 5 | trust 5 | risk_propensity 2
AUTOEMPLEO;14;El Favor de la ONG;Una ONG te pide fotos gratis para una campaña solidaria. Te toca la fibra.;Lo hago gratis. Es mi aportación al mundo (Pro bono).;altruism 10 | generosity 5 | profit -5;Les cobro una tarifa reducida "simbólica". El trabajo se paga, la causa se apoya.;balance 5 | pragmatism 5 | kindness 5;Les pido que me dejen poner mi logo bien grande a cambio. Visibilidad.;mercenary 2 | marketing 5 | negotiation 5;Me niego. "Yo también soy una ONG (Yo S.L.) y necesito comer".;cynicism 5 | boundaries 5 | coldness 2
AUTOEMPLEO;15;La Oferta de Trabajo;Llevas 2 meses flojos. Te ofrecen un puesto de dependiente en FNAC. Sueldo fijo, horario fijo. Cero creatividad.;Lo cojo. Necesito paz mental y nómina. Cierro el chiringuito una temporada.;security 10 | surrender 5 | realism 5 | creativity -10;Ni muerto. Prefiero comer arroz blanco que fichar para otro. Soy libre.;autonomy 10 | persistence 5 | stubbornness 5 | hardship 5;Lo cojo a media jornada y sigo con las fotos por la tarde. Doble vida.;effort 10 | sacrifice 5 | resilience 5;Le pido dinero a mis padres para aguantar la mala racha.;dependent 10 | risk_propensity -5 | shame 2
AUTOEMPLEO;16;Intrusismo Laboral;Ves a un tipo en el parque cobrando 20€ por sesiones de fotos con una cámara peor que la tuya y sin pagar impuestos.;Llamo a la policía local para denunciar actividad ilegal. Que pague como todos.;justice 5 | aggression 5 | resentment 5;Me acerco y le doy mi tarjeta. "Si quieres aprender a hacerlo bien, llámame".;arrogant 5 | mentorship 2 | superiority 5;Le ignoro. Ese no es mi cliente. Mi cliente busca calidad, no precio.;confidence 10 | focus 5 | maturity 5;Me deprimo pensando que la profesión se muere.;pessimism 5 | emotional_stability -5 | victim 5
AUTOEMPLEO;17;El Contrato Verbal;Un amigo de un amigo te encarga algo "de palabra". Entregas y ahora se hace el loco con el pago.;Voy a su casa/oficina a exigir el pago en persona. Me pongo serio.;assertiveness 10 | confrontation 5 | risk_propensity 2;Le bombardeo a WhatsApps y llamadas. Acoso digital.;persistence 5 | desperation 5;Lo doy por perdido. Aprendo la lección: "Sin firma no hay trabajo".;learning 5 | defeat 5 | naive -5;Le amenazo con borrar/bloquear el trabajo o difamarle en redes.;revenge 5 | aggression 5 | risk_propensity 5
AUTOEMPLEO;18;Diversificar o Morir;Solo haces bodas. Llega el invierno (no hay bodas).;Empiezo a hacer fotos de producto/inmobiliaria aunque sea más aburrido. Hay que comer.;adaptability 10 | pragmatism 5 | humility 5;Vendo cursos de fotografía para novatos online. Ingresos pasivos (o intento).;innovativeness 5 | teaching 5 | entrepreneurship 5;Me paso el invierno editando portfolio y preparando la temporada siguiente sin ingresos.;planning 5 | savings_reliance 5 | risk_propensity 2;Me quedo quieto quejándome de la estacionalidad.;passive 5 | complaining 5 | lack_foresight 5
AUTOEMPLEO;19;El Espacio de Trabajo;Trabajas en la mesa del salón. Tu casa está llena de cables. Tu vida es un caos.;Habilito una habitación solo como despacho. Cuando salgo de ahí, no trabajo.;discipline 5 | organization 5 | boundaries 5;Sigo en el salón. Me gusta trabajar en pijama y parar a poner lavadoras.;comfort 5 | chaos 5 | blurring_lines 5;Me voy a la biblioteca pública (gratis) para obligarme a vestirme y salir.;resourcefulness 5 | routine 5 | frugal 5;Alquilo un estudio compartido con otros artistas. Caro pero inspirador.;social 5 | investment 5 | creativity 5
AUTOEMPLEO;20;La Copia de Seguridad;Se te cae el disco duro externo. Hace 3 meses que no haces backup en la nube. Tienes fotos de clientes dentro.;Pago 1.000€ a un laboratorio de recuperación de datos llorando. El error se paga.;responsibility 5 | cost 10 | crisis_mgmt 5;Le digo al cliente que "la tarjeta de memoria falló" (mentira) y le devuelvo el dinero.;deception 5 | cowardice 5 | reputation -10;Intento arreglarlo yo con software pirata y tutoriales de YouTube.;risk_propensity 10 | cheap 5 | hope 5;Tengo backup automático en la nube. Estoy tranquilo. (Esta opción es para los listos).;diligent 10 | foresight 10 | peace 5
AUTOEMPLEO;21;Salud Postural;Te duele la espalda de cargar la cámara y editar 8 horas en silla mala. Tienes 30 años y pareces de 60.;Me apunto al gimnasio/yoga y compro una silla Herman Miller (1.000€). Inversión en salud.;self_care 10 | investment 5 | long_term 5;Sigo igual a base de Ibuprofeno y masajes puntuales. Ya pararé cuando me rompa.;neglect 5 | short_term 5 | health -5;Trabajo desde la cama con el portátil. Comodidad absoluta (y destrucción de columna).;laziness 5 | comfort 5 | health -10;Contrato un seguro médico privado por si acaso.;cautious 5 | security 5 | cost 2
AUTOEMPLEO;22;Marca Personal;Tu web es de 2015. Tu Instagram está muerto. Sabes que deberías actualizarlo, pero te da pereza venderte.;Contrato a un diseñador web para que me lo haga. Zapatero a tus zapatos.;delegation 5 | investment 5 | professional 5;Lo hago yo con una plantilla moderna este finde. Renovarse o morir.;autonomy 5 | effort 5 | image 5;Sigo con el boca a boca. "Mi trabajo es mi mejor marketing". (Arriesgado).;conservative 5 | trust 5 | risk_propensity 2;Me abro TikTok y hago el ridículo bailando para pillar clientes jóvenes.;desperation 5 | adaptability 5 | dignity -2
AUTOEMPLEO;23;El Cliente Indeciso;Te ha pedido 15 cambios en el presupuesto. Te llama 3 veces al día. Aún no ha pagado un euro. Huele a problema.;Le digo: "Mira, creo que no soy el profesional que buscas". Le despido antes de empezar.;intuition 10 | boundaries 5 | self_protection 5;Le aguanto todo porque necesito el dinero. Paciencia infinita.;dependent 5 | patience 5 | suffering 5;Le subo el precio un 30% por "Gastos de Gestión de Cliente". Tasa de dolor.;mercenary 5 | astute 5 | defense 5;Le contesto cada vez más tarde para que se aburra.;passive_aggressive 5 | avoidance 5
AUTOEMPLEO;24;La Gestoría;Haces tus propias facturas y modelos de Hacienda para ahorrarte 50€ al mes.;Contrato un gestor. Mi tiempo vale más que 50€ y no quiero multas.;smart 5 | delegation 5 | peace 5 | efficiency 5;Sigo haciéndolo yo. Me gusta tener el control y entender mis números.;autonomy 5 | control 5 | frugal 5;Lo hace mi cuñado que "sabe de esto". (Peligro).;nepotism 5 | risk_propensity 5 | cheap 5;Uso un software automatizado que lo hace solo.;innovativeness 5 | efficiency 5 | tech 5
