SECTOR;MES;TITULO;NARRATIVA;OPCION_A_TXT;OPCION_A_LOGIC;OPCION_B_TXT;OPCION_B_LOGIC;OPCION_C_TXT;OPCION_C_LOGIC;OPCION_D_TXT;OPCION_D_LOGIC
INTRA;40;El Techo de Cristal;Sientes que no vas a ascender más. Has tocado techo en esta empresa. Estás cómodo y cobras bien, pero no hay reto.;Me voy. Necesito crecer. La comodidad es la muerte profesional. Busco retos fuera.;growth_mindset 25 | ambition 20 | change 15 | exit 10;"Me quedo. ""Hace mucho frío fuera"". Disfruto de mi estatus y mi sueldo. Priorizo la estabilidad.";stability 25 | comfort 20 | fear 15 | settlement 10;Me reinvento dentro. Busco proyectos laterales o horizontales para entretenerme. Job crafting.;proactivity 20 | creativity 15 | renewal 10 | patience 5;Me dedico a vivir. Hago lo mínimo y centro mi energía en mis hobbies. Trabajo alimenticio.;detachment 20 | balance 15 | joy 10 | minimum 5
SALUD;1;El MVP Ético;"Has creado una App de diagnóstico dermatológico con IA. Funciona al 85%. Los inversores quieren lanzar ya (""Move fast""). Pero en salud, un error del 15% puede significar no detectar un cáncer real. La competencia va a lanzar en un mes.";"Lanzo con un ""disclaimer"" legal gigante que dice ""Esto no es un diagnóstico médico"". Traslado la responsabilidad al usuario y empiezo a facturar para mejorar el algoritmo.";pragmatism 25 | risk_propensity 20 | ethics -10 | speed 15;No lanzo hasta tener el 99% de fiabilidad y certificación médica. En salud no se juega. Prefiero quebrar esperando que matar a alguien por error.;ethics 25 | diligence 20 | caution 15 | slow 10;Lanzo una beta cerrada solo para médicos, usándolos de filtro de seguridad. Crezco más lento pero validado por profesionales.;strategy 25 | prudence 20 | alliance 15 | quality 10;Lanzo solo para enfermedades leves (acné), bloqueando los diagnósticos graves hasta estar seguro. Segmento el riesgo.;segmentation 20 | smart 15 | balance 10 | safety 5
SALUD;2;El Socio Científico;"Tu socio es un científico brillante (Premio Nacional) pero no tiene ni idea de negocios y bloquea todas las decisiones comerciales por ""purismo"". Los inversores dicen que es un lastre para la venta.";Le aparto de la gestión. Le dejo en un consejo científico honorífico y tomo yo el control ejecutivo total. El laboratorio para él, la empresa para mí.;assertiveness 25 | leadership 20 | role_clarity 15 | conflict 10;Le mantengo en el poder por respeto y miedo a que se vaya. La empresa es su cerebro. Si él se va, no hay producto. Trago con su lentitud.;dependency 25 | loyalty 20 | fear 15 | patience 10;"Contrato a un CEO externo ""tiburón"" para que se pelee él con el científico. Pongo un parachoques humano entre los dos.";delegation 20 | conflict_avoidance 15 | expense 10 | strategy 5;Le compro su parte (Buyout) y le contrato como asesor externo. Le saco del accionariado para tener libertad de maniobra.;ownership 25 | financial_risk 20 | autonomy 15 | boldness 10
SALUD;3;Burocracia Sanitaria;"Para vender tu producto a la Sanidad Pública necesitas 2 años de papeleo y ensayos clínicos. Te quedarás sin caja en 6 meses. Tienes la opción de venderlo como ""Producto de Bienestar"" (sin certificar) en farmacias mañana mismo.";Lo vendo como Bienestar. Necesito facturar para sobrevivir. Ya buscaré la certificación médica más adelante con el dinero que gane ahora.;pivot 25 | survival 20 | flexibility 15 | regulatory_risk 10;Aguanto y busco subvenciones o préstamos para resistir los 2 años. Mi visión es clínica, no de teletienda. No quiero diluir mi marca científica.;tenacity 25 | vision 20 | patience 15 | financial_stress 10;Vendo la patente a una farmacéutica grande que tenga pulmón para aguantar la burocracia. Me rindo, cobro y me voy.;exit 20 | realism 15 | detachment 10 | easy 5;Me voy a un país con regulación más laxa para lanzar allí primero y luego volver con datos reales (Real World Evidence).;global 20 | mobility 15 | astute 10 | effort 5
SALUD;4;Datos de Pacientes;Una aseguradora te ofrece comprar los datos anonimizados de tus usuarios por un dineral. Es legal si está en la letra pequeña, pero sabes que tus usuarios se sentirían traicionados si lo supieran.;Vendo los datos. Es el modelo de negocio estándar en digital health. El dato es el nuevo petróleo y necesito gasolina para crecer.;business 25 | profit 20 | cynicism 15 | privacy_risk 10;No vendo. La privacidad de salud es sagrada. Mi confianza con el paciente es mi único activo real. Busco otra forma de monetizar.;integrity 25 | ethics 20 | trust 15 | poverty 5;"Vendo solo ""insights"" agregados (informes de tendencias) sin dar datos brutos. Busco un punto medio ético y rentable.";balance 20 | creativity 15 | negotiation 10 | smart 5;"Les pregunto a los usuarios. ""¿Queréis la App gratis a cambio de ceder datos, o pagáis 5€/mes?"". Transparencia radical.";transparency 25 | democracy 20 | risk 10 | fairness 10
SALUD;5;El Placebo Rentable;Tu producto estrella (suplemento/terapia) se vende muy bien, pero los últimos estudios internos dicen que su efecto es casi nulo (Placebo). Es inofensivo, pero inútil. La gente está contenta y compra.;Lo sigo vendiendo. Si la gente se siente mejor (efecto placebo), estoy ayudando. Y el negocio va como un tiro. No soy quien para romper su ilusión.;justification 20 | profit 15 | marketing 10 | ethics -10;Lo retiro del mercado o cambio la fórmula. No puedo vender humo. Me siento un estafador. Prefiero cerrar una línea de negocio a mentir.;integrity 25 | honesty 20 | courage 15 | loss 10;"Cambio el marketing para prometer menos (""Ayuda a..."") y estar legalmente cubierto, pero sigo vendiendo lo mismo.";compliance 15 | cynicism 10 | legal 10 | survival 5;Invierto los beneficios en I+D para intentar que el producto funcione de verdad en la versión 2.0. Uso el dinero del placebo para crear ciencia.;strategy 20 | hope 15 | investment 10 | long_term 5
SALUD;6;Médicos vs Comerciales;"Tus visitadores médicos son agresivos vendiendo. Algunos médicos se quejan de que son ""demasiado comerciales"" y poco técnicos. Pero son los que traen las ventas y pagan las nóminas.";"Les pido que sigan así. Esto es una guerra comercial y necesito ""killers"". Si el médico compra, es que funciona. Los resultados mandan.";sales 25 | aggression 20 | results 15 | reputation_risk 10;"Les freno. ""Somos consultores, no vendedores de alfombras"". Les obligo a formarse técnicamente y a ser más suaves. Perderé ventas a corto.";quality 25 | reputation 20 | long_term 15 | sales_drop 10;Contrato a médicos para que vendan a médicos (Medical Science Liaisons). Es más caro y venden menos, pero con más nivel y prestigio.;prestige 20 | cost 15 | strategy 10 | trust 5;"Divido el equipo: ""Hunters"" agresivos para abrir puertas y ""Farmers"" técnicos para mantener la cuenta. Especialización de roles.";structure 20 | management 15 | efficiency 10 | balance 5
SALUD;7;Humanización vs Rentabilidad;Diriges una clínica privada. Puedes meter a 4 pacientes por hora (15 min) y ser muy rentable, o a 2 (30 min) y dar un trato humano excelente pero ganar poco.;4 pacientes/hora. Volumen. Necesito pagar las máquinas y los sueldos. La medicina privada es un negocio de rotación y eficiencia.;business 25 | efficiency 20 | profit 15 | care -10;2 pacientes/hora. Calidad. Me hice médico para curar, no para despachar. Si no es rentable, subiré el precio, pero no bajaré el tiempo.;care 25 | vocation 20 | quality 15 | pricing 10;Contrato enfermeras para que hagan el triaje y la burocracia, y yo solo entro 5 minutos a la parte clave. Optimización de tiempos.;delegation 20 | process 15 | smart 10 | efficiency 5;"Ofrezco dos tarifas: ""Consulta Express"" (barata) y ""Consulta Premium"" (larga). Que el paciente elija cuánto tiempo quiere comprar.";segmentation 25 | innovation 20 | choice 15 | market 10
SALUD;8;El Error Médico (Propio);Has cometido un error en un tratamiento. El paciente no se ha dado cuenta y las consecuencias son leves (molestias). Si se lo dices, te puede demandar y arruinar tu reputación.;Se lo digo. Pido perdón y reparo el daño gratis. La relación médico-paciente se basa en la verdad. Asumo las consecuencias legales.;integrity 25 | courage 20 | responsibility 15 | risk 10;"Me callo. Le trato las ""molestias"" como si fueran un efecto secundario normal. ""Ojos que no ven..."". Protejo mi carrera y el seguro.";self_preservation 25 | fear 20 | deceit 15 | safety 10;Lo anoto en la historia clínica para estar cubierto legalmente, pero no se lo verbalizo explícitamente. Burocracia defensiva.;defensive 20 | legal 15 | ambiguity 10 | caution 5;Le hago un descuento o regalo en el próximo tratamiento para compensar mi culpa sin admitir el error. Compensación silenciosa.;guilt 15 | compromise 10 | avoidance 10 | niceness 5
SALUD;9;Telemedicina Forzosa;Tus pacientes mayores quieren verte en persona. Tú quieres pasar a telemedicina para ahorrar costes de local y trabajar desde casa. Tienes un conflicto generacional.;Impongo la telemedicina. El mundo avanza. Les pongo tutoriales y facilidades, pero cierro la consulta física. Renovarse o morir.;modernity 25 | efficiency 20 | firmness 15 | customer_loss 10;Mantengo lo físico. Mi nicho es la gente mayor y ellos pagan por el contacto. Soy un servicio de proximidad. La tecnología espera.;service 25 | empathy 20 | tradition 15 | cost 10;Modelo híbrido: Cobro más caro por la visita presencial (Lujo) y más barato por la online. Incentivo el cambio con el precio.;pricing 20 | transition 15 | strategy 10 | balance 5;Voy yo a sus casas (a domicilio). Cobro un extra por desplazamiento. Servicio VIP ultra-personalizado. Uberización médica.;effort 25 | service 20 | niche 15 | logistics 10
SALUD;10;Colaborar con la Pública;La Sanidad Pública está colapsada. Puedes ofrecerte para coger sus listas de espera a precio bajo. Es volumen seguro pero paga mal y tarde. O seguir solo con privados.;Cojo las listas de espera. Volumen es volumen. Lleno la clínica y aseguro ingresos fijos, aunque el margen sea pequeño. Seguridad.;volume 25 | security 20 | collaboration 15 | margin -5;Sigo solo privado. Quiero cobrar bien y pronto. No quiero depender de la administración ni bajar mi caché. Exclusividad.;elitism 25 | independence 20 | profit 15 | quality 10;Cojo solo las pruebas diagnósticas (máquinas) que son rápidas, pero no las consultas. Rentabilizo el equipo, no mi tiempo.;efficiency 20 | strategy 15 | focus 10 | smart 5;Uso la pública como marketing: atiendo bien a los derivados para que luego vuelvan a mí por lo privado. Embudo de ventas.;marketing 25 | cunning 20 | conversion 15 | long_term 10
SALUD;11;Burnout Sanitario;Estás agotado de escuchar problemas de salud todo el día. Tienes fatiga por compasión. Empiezas a tratar a los pacientes como números para no sufrir.;Me tomo un descanso o reduzco jornada drásticamente. Si yo no estoy bien, no puedo cuidar a nadie. Priorizo mi salud mental.;self_care 25 | boundaries 20 | sustainability 15 | income_loss 10;"Sigo trabajando en modo ""robot"". Me disocio emocionalmente. Soy un técnico eficiente pero frío. Supervivencia profesional.";resilience 20 | detachment 15 | professionalism 10 | humanity -10;Voy a terapia y supervisión para gestionar la carga. Invierto en mi herramienta de trabajo (yo mismo) para seguir aguantando.;growth 20 | responsibility 15 | support 10 | cost 5;Cambio de especialidad o me dedico a gestión/docencia para no ver pacientes un tiempo. Huida lateral.;adaptation 25 | avoidance 20 | change 15 | relief 10
SALUD;12;La Moda Pseudocientífica;"Se ha puesto de moda una terapia sin base científica (Reiki, Detox...) que los clientes piden mucho. Es dinero fácil y ""no hace daño"".";La ofrezco. Si el cliente lo pide y paga, se lo doy. Soy un proveedor de servicios de salud/bienestar, no un guardián de la ciencia.;business 25 | flexibility 20 | opportunism 15 | rigor -10;Me niego. En mi centro solo entra ciencia. Mi reputación y mi ética valen más que la moda de turno. Pierdo ese dinero con orgullo.;integrity 25 | rigor 20 | prestige 15 | loss 10;"Contrato a un externo que lo haga en mis instalaciones alquilándole el espacio. ""Yo no lo hago, pero aquí se hace"". Me lavo las manos.";distancing 20 | profit 15 | excuse 10 | smart 5;Les explico a los clientes por qué no funciona e intento venderles la alternativa científica. Educar al paciente es mi deber.;education 25 | patience 20 | authority 15 | sales 10
SALUD;13;Competencia Desleal;"Una clínica vecina hace ofertas agresivas (""Implante a 200€"") que sabes que son engañosas (luego cobran extras). Te están robando pacientes.";Les denuncio al colegio de médicos/odontólogos por publicidad engañosa. Juego la carta legal y corporativa. Defensa gremial.;justice 25 | legal 20 | conflict 15 | trust 10;"Hago una campaña explicando ""Lo que esconde el precio bajo"". Educo al paciente sobre la calidad para diferenciarme. Guerra de valor.";marketing 25 | quality 20 | differentiation 15 | defense 10;Bajo mis precios para competir, recortando en materiales o tiempos. Entro al trapo del Low Cost por miedo a desaparecer.;fear 20 | survival 15 | race_to_bottom 10 | quality_risk 15;"Les ignoro. ""Lo barato sale caro"". Espero a que vengan los pacientes rebotados de allí con problemas para arreglárselos yo.";patience 20 | confidence 15 | arrogance 10 | passivity 5
SALUD;14;Inversión Tecnológica;Ha salido un escáner nuevo carísimo (200k) que mejora un poco el diagnóstico. Tu competencia lo ha comprado y lo anuncia. Tú tienes uno de hace 5 años que funciona bien.;Lo compro. No puedo quedarme atrás tecnológicamente. La medicina es tecnología. Me endeudo para estar a la vanguardia y dar imagen.;innovativeness 25 | investment 20 | competitiveness 15 | debt 10;No lo compro. Mi valor son mis manos y mi ojo clínico, no la máquina. Espero a que se rompa el viejo. Rentabilidad sobre novedad.;prudence 25 | confidence 20 | conservation 15 | saving 10;Hago un acuerdo con un centro de radiología para derivar allí a los pacientes que lo necesiten de verdad. Externalizo el coste.;collaboration 20 | efficiency 15 | smart 10 | network 5;"Le hago un ""lifting"" a mi máquina vieja y mejoro la sala de espera para que parezca todo más moderno. Marketing visual.";image 20 | superficiality 15 | saving 10 | trick 5
SALUD;15;El Paciente Insoportable;Un paciente paga bien pero trata mal a tu recepcionista, llega tarde siempre y se queja de todo. Te amarga el día cada vez que viene.;"Le invito a irse a otro sitio. ""Creo que no somos la clínica adecuada para usted"". Protejo a mi equipo y mi paz mental. Despido al cliente.";dignity 25 | culture 20 | boundaries 15 | loss 10;"Le aguanto. ""El cliente paga"". Le cobro un plus mentalmente. Le doy cita a última hora para que no moleste a otros. Trago.";tolerance 20 | money 15 | submission 10 | pragmatism 5;Le siento y le leo la cartilla. Le pongo límites claros de comportamiento. Si los acepta bien, si no, puerta. Confrontación educativa.;assertiveness 25 | authority 20 | education 15 | risk 5;Le paso con mi socio o con otro médico de la clínica que tenga más paciencia. Me lo quito de encima yo.;delegation 20 | relief 15 | avoidance 10 | team 5
SALUD;16;Preventiva vs Curativa;Ganas más dinero operando (curativa) que enseñando hábitos saludables (preventiva). Si tus pacientes se cuidan, te necesitan menos.;Me centro en operar. Es mi negocio. Si enferman, yo les curo. No soy responsable de sus hábitos. Incentivo perverso pero real.;profit 25 | realism 20 | focus 15 | ethics -5;"Creo una unidad de ""Medicina del Estilo de Vida"". Cobro por mantenerles sanos (suscripción). Cambio el modelo a salud, no enfermedad.";innovativeness 25 | ethics 20 | vision 15 | long_term 10;Hago charlas gratuitas de prevención como marketing para captar pacientes para operar. Uso la salud como gancho comercial.;marketing 20 | strategy 15 | balance 10 | smart 5;Les doy consejos rápidos en consulta pero sé que no los seguirán. Cumplo moralmente pero vivo de la patología.;conformity 20 | cynicism 15 | routine 10 | stability 5
SALUD;17;Seguro Médico Privado;Las aseguradoras te pagan una miseria por visita (15€) y tardan en pagar. Pero te llenan la agenda de pacientes sin esfuerzo comercial.;Rompo con los seguros. Me hago 100% privado. Veré a menos pacientes pero cobraré lo que valgo (100€). Apuesto por la calidad y el riesgo.;elitism 25 | courage 20 | quality 15 | risk 10;"Sigo con los seguros. Me dan volumen y seguridad. Hago ""medicina de batalla"" rápida para que sea rentable. Supervivencia por volumen.";volume 20 | security 15 | burnout 10 | mediocrity 5;Mantengo un par de seguros buenos y quito los malos. Voy haciendo una transición suave hacia lo privado sin saltar al vacío.;gradualism 20 | strategy 15 | balance 10 | caution 5;Uso los seguros para captar al paciente y luego intento venderle tratamientos no cubiertos (privados) dentro de la consulta.;upselling 25 | business 20 | smart 15 | hustle 10
SALUD;18;Protección de Datos;Tienes los historiales en papel en archivadores con llave, como toda la vida. La ley te obliga a digitalizar y encriptar todo. Te da pereza y miedo a los hackers.;Digitalizo todo. Contrato un software seguro en la nube. Cumplo la ley y modernizo la clínica, aunque me cueste dinero y esfuerzo.;compliance 25 | modernization 20 | diligence 15 | cost 10;"Sigo con el papel. ""Nunca me han entrado a robar"". Es más seguro que internet. Me arriesgo a la multa por protección de datos. Resistencia.";tradition 20 | resistance 15 | risk 10 | saving 5;Escaneo todo a un disco duro local desconectado de internet. Solución casera intermedia. Ni papel ni nube. Seguridad por aislamiento.;prudence 20 | control 15 | fear 10 | compromise 5;Contrato a una empresa externa de custodia de archivos para que se lleven los papeles y los guarden ellos. Externalizo el problema.;delegation 20 | cost 15 | relief 10 | avoidance 5
SALUD;19;El Familiar del Médico;Te piden que trates a tu padre o a tu hijo de algo serio. Sabes que pierdes objetividad y que si sale mal, destrozará la familia.;"Me niego. ""Los médicos no tratan a su familia"". Les derivo al mejor colega que conozco. Ética profesional y protección personal.";ethics 25 | prudence 20 | boundaries 15 | love 10;"Les trato. ""Nadie les va a cuidar mejor que yo"". Confío en mi técnica y asumo la carga emocional extra. Soberbia profesional.";confidence 20 | commitment 15 | risk 10 | arrogance 5;Estoy presente en la cirugía/consulta pero dejo que opere otro. Superviso pero no ejecuto. Control freak.;control 20 | anxiety 15 | involvement 10 | distrust 5;Les trato solo cosas menores, pero lo grave lo derivo. Pongo límites según la gravedad del asunto.;balance 20 | logic 15 | safety 10 | compromise 5
SALUD;20;Jubilación del Fundador;Eres el médico fundador de la clínica. Tienes 70 años. Tus pacientes solo quieren verte a ti. Si te vas, la clínica puede morir o perder valor.;Vendo la clínica a un grupo inversor y me voy. Que gestionen ellos la transición. Yo cobro mi salida y disfruto lo que me queda. Desapego.;exit 25 | detachment 20 | wealth 15 | realism 10;"Ficho a un sucesor joven y estoy 2 años presentándole a los pacientes (""es muy bueno""). Transición ordenada y tutelada.";legacy 25 | responsibility 20 | mentorship 15 | patience 10;Sigo trabajando hasta que me muera con las botas puestas. La clínica soy yo. Sin mí, esto no tiene sentido. Identidad total.;identity 20 | attachment 15 | denial 10 | passion 5;Le paso la clínica a mi hijo (que es médico) aunque no sea tan bueno ni tenga carisma. Dinastía familiar ciega.;family 20 | nepotism 15 | hope 10 | risk 5
SALUD;21;La Lista Forbes;"Te han nominado a los ""Top Doctors"". Requiere ir a galas, entrevistas y pagar una cuota de marketing. Te quita tiempo de consulta.";"Pago y voy. Es marketing de prestigio. Los pacientes quieren ir al médico ""famoso"". Subo mi caché gracias a la fama.";image 25 | narcissism 20 | marketing 15 | business 10;Paso de listas. Mi prestigio está en el quirófano, no en las revistas. Mis pacientes vienen por el boca a boca.;integrity 25 | diligence 20 | focus 15 | humility 10;Uso el logo del premio en la web pero no voy a los eventos. Aprovecho la marca sin perder tiempo.;efficiency 20 | pragmatism 15 | branding 10 | smart 5;"Critico públicamente esos premios como ""fraude de pago"". Me posiciono como el médico antisistema.";rebellion 20 | conflict 15 | authenticity 10 | risk 5
SALUD;22;El Comercial de Pharma;"Un visitador te ofrece un viaje al Caribe ""para un congreso"" si recetas su medicamento (que es igual que el genérico pero más caro).";"Acepto el viaje. ""Todos lo hacen"". Es una compensación por mi duro trabajo. El medicamento es bueno, no hago daño a nadie.";opportunism 25 | greed 20 | rationalization 15 | ethics -10;Le echo de la consulta. Mi receta no se vende. Receto lo mejor para el paciente, no lo que me paga vacaciones.;ethics 25 | integrity 20 | independence 15 | pride 10;Le pido que en vez de viaje me pague la inscripción a un curso real o libros. Intento blanquear el soborno.;negotiation 20 | education 15 | balance 10 | grey_area 5;Receto su medicamento solo si es estrictamente necesario, pero cojo los bolígrafos y muestras gratis. Pequeña corrupción.;weakness 20 | compromise 15 | passive 10 | petty 5
SALUD;23;El Paciente VIP;Un famoso quiere operarse contigo pero exige que cierres la planta para él y saltarse la lista de espera. Paga el triple.;Acepto. El dinero del VIP financia mejoras para todos. Es un servicio premium. El dinero manda.;business 25 | inequality 20 | profit 15 | flexibility 10;"Me niego. ""Aquí todos los pacientes son iguales"". La salud no entiende de clases. Respeto mi lista de espera.";justice 25 | equality 20 | ethics 15 | integrity 10;Le opero en horario extra (sábado) para no afectar a los demás. Hago un esfuerzo extra para cobrar el extra.;effort 20 | accommodation 15 | wealth 10 | balance 5;Le derivo a una clínica de lujo amiga y cobro comisión. No quiero ese circo en mi casa.;referral 20 | smart 15 | peace 10 | profit 5
SALUD;24;Cobrar Cita Fallida;Tienes un 20% de pacientes que no aparecen (No-Show). Pierdes dinero. ¿Empiezas a cobrar la cita por adelantado o multar?;Cobro por adelantado. Mi tiempo es dinero. Si reservan, pagan. Educo al paciente a golpe de tarjeta.;firmness 25 | efficiency 20 | business 15 | risk 10;Sigo sin cobrar. Me da miedo que si cobro antes, no reserven. Asumo el 20% de fallo como coste estructural.;fear 25 | passivity 20 | customer_service 15 | loss 10;Les llamo el día antes para confirmar. Pongo a una secretaria a perseguirles. Gasto humano para asegurar asistencia.;diligence 20 | control 15 | effort 10 | prevention 5;Sobresaturo la agenda (Overbooking) asumiendo que alguien fallará. Si vienen todos, se espera. Modelo aerolínea.;risk_propensity 25 | volume 20 | stress 15 | greed 5
SALUD;25;Guerra de Precios Dental;"Ha abierto un ""Dentix"" al lado con implantes tirados de precio. Tus pacientes te preguntan por qué eres tan caro.";"Mantengo precios y explico la calidad. ""Yo uso titanio, ellos lata"". Hago pedagogía del valor. No compito en precio.";quality 25 | education 20 | confidence 15 | differentiation 10;Bajo precios y compro material más barato. El mercado manda y la gente solo mira el bolsillo. Me adapto a la baja.;survival 20 | adaptation 15 | race_to_bottom 10 | risk 10;"Lanzo una segunda marca ""Low Cost"" en otro local para captar a ese público sin manchar mi nombre.";strategy 25 | diversification 20 | segmentation 15 | smart 10;Hago ofertas gancho (limpieza gratis) para que entren y luego venderles calidad. Marketing agresivo.;marketing 20 | cunning 15 | sales 10 | hustle 5
SALUD;26;La Máquina de 100k;"Ha salido un láser nuevo. No hay evidencia clara de que sea mejor, pero ""viste mucho"" tenerlo. Cuesta 100.000€.";"Lo compro. El efecto placebo y el marketing de tener ""lo último"" atraerán pacientes. Es una inversión de imagen.";image 25 | risk_propensity 20 | marketing 15 | tech 10;Espero a la evidencia. No gasto 100k en juguetes. Soy científico, no feriante. Prudencia financiera y médica.;prudence 25 | skepticism 20 | science 15 | saving 10;Lo alquilo por días (Renting) para probar si hay demanda antes de comprar. Testeo de mercado.;strategy 20 | caution 15 | smart 10 | efficiency 5;Compro el modelo anterior de segunda mano que hace lo mismo pero es más barato. Funcionalidad sobre novedad.;frugality 20 | pragmatism 15 | utility 10 | smart 5
SALUD;27;El Error del Compañero;Ves que un compañero de la clínica comete un error diagnóstico grave. Es tu amigo. Si lo reportas, le expedientan.;Lo reporto. La seguridad del paciente está por encima de la amistad. El corporativismo mata. Integridad dolorosa.;integrity 25 | responsibility 20 | justice 15 | betrayal 10;Hablo con él en privado para que rectifique, pero no lo reporto. Le protejo y espero que aprenda. Lealtad mal entendida.;loyalty 25 | protection 20 | risk 15 | secrecy 10;"Me callo. ""Entre bomberos no nos pisamos la manguera"". No soy policía. Miedo a represalias.";fear 20 | complicity 15 | passivity 10 | silence 5;Lo arreglo yo discretamente sin decir nada a nadie. Me cargo de trabajo extra para tapar su fallo.;sacrifice 20 | intervention 15 | burden 10 | covering 5
