SECTOR;MES;TITULO;NARRATIVA;OPCION_A_TXT;OPCION_A_LOGIC;OPCION_B_TXT;OPCION_B_LOGIC;OPCION_C_TXT;OPCION_C_LOGIC;OPCION_D_TXT;OPCION_D_LOGIC
TECH;1;La Imperfección del Lanzamiento;"Es el Día D. Lleváis 6 meses quemando caja. El backend es sólido, pero la experiencia de usuario (UX) en móviles tiene fallos visuales evidentes que pueden frustrar a los primeros usuarios. Tu competencia directa lanza su beta en 48 horas. Si esperas a arreglarlo, pierdes el ""First Mover Advantage"". Si lanzas, arriesgas tu reputación inicial.";Lanzo hoy mismo asumiendo el riesgo. La velocidad es vital en Tech. Pondré a todo el equipo a hacer soporte técnico 24/7 para compensar los fallos manualmente mientras parcheamos.;risk_propensity 20 | achievement 15 | diligence 5 | emotional_stability 5;Retraso el lanzamiento 3 semanas. Solo hay una oportunidad para causar una primera impresión. Prefiero llegar segundo con un producto excelente que primero con uno roto.;diligent 20 | cautious 10 | achievement -5 | perfectionism 10;"Lanzo una ""Beta Privada"" solo por invitación a 50 usuarios de confianza. Valido la tecnología sin exponer la marca al gran público, aunque cedo terreno mediático a la competencia.";cautious 15 | risk_propensity -5 | innovativeness 5 | strategy 10;Lanzo solo la versión de escritorio (que funciona bien) y elimino la opción móvil temporalmente, aunque eso signifique ignorar al 60% del tráfico actual.;pragmatism 15 | focus 10 | risk_propensity 5 | market_share -10
TECH;2;Dinero Tóxico vs Libertad;Queda caja para 1 mes (Runway crítico). Un Fondo de Inversión (VC) ofrece 500.000€, lo que os salvaría, pero sus condiciones son leoninas: quieren el 40% de la empresa, veto en decisiones estratégicas y sugieren reemplazar a tu co-founder técnico. La alternativa es cerrar o mendigar micro-créditos.;Firmo el acuerdo. El dinero es oxígeno y sin él morimos hoy. Ya pelearé por recuperar el control político de la empresa cuando tengamos tracción y métricas.;risk_propensity 15 | pragmatism 20 | autonomy -15 | survival 20;"Rechazo la oferta. Esa valoración es un insulto y no voy a traicionar a mi socio. Prefiero reducir la empresa al mínimo y sobrevivir con ""Ramen Profitability"".";autonomy 25 | loyalty 15 | risk_propensity 5 | ambition -10;Negocio agresivamente: Acepto su valoración y el veto, pero blindo a mi equipo fundador por contrato durante 2 años. Cedo control económico a cambio de estabilidad humana.;negotiation 20 | emotional_stability 10 | team_focus 15 | power -5;Busco financiación alternativa desesperada (Friends & Family, préstamos personales). Pongo mi patrimonio personal en riesgo antes que vender mi alma al fondo.;risk_propensity 25 | self_efficacy 15 | independence 10 | financial_risk 20
TECH;3;La Tiranía del Dato;"Lleváis meses construyendo una plataforma para conectar paseadores de perros (idea original). Las métricas son terribles: nadie paga. Sin embargo, observas que los usuarios están usando el chat interno de la App para ligar entre ellos. Tu equipo de desarrolladores ama la idea original y odiaría pivotar a una ""App de citas"".";Pivoto radicalmente a App de citas HOY. Los datos mandan y el mercado nunca se equivoca. Si el equipo no lo entiende, tendré que renovar la plantilla.;innovativeness 25 | adaptability 20 | empathy -10 | achievement 15;Sigo con la idea original de los perros. El mercado es lento y hay que educarlo. Invierto lo que queda de marketing en explicar mejor nuestra propuesta de valor.;perseverance 20 | stubbornness 10 | risk_propensity -5 | vision 10;Mantengo los dos productos en paralelo. Uso la funcionalidad de citas para atraer tráfico y trato de reconvertirlos al negocio de paseadores. No quiero cerrar puertas.;cautious 10 | focus -15 | creativity 15 | fear 5;Vendo la tecnología desarrollada a una empresa de mascotas establecida y uso ese capital para empezar otro proyecto diferente desde cero. Salida digna.;mercenary 15 | detachment 20 | emotional_stability 10 | achievement 5
TECH;4;El Genio Destructivo;"Tu CTO (Director Técnico) es un genio absoluto, el mejor programador que has visto. Pero su actitud es tóxica: humilla a los juniors, no documenta nada y crea mal ambiente. Hoy, el Lead Developer te ha dado un ultimátum: ""O se va él, o nos vamos nosotros tres"". Sin el CTO, el producto podría caerse mañana.";Despido al CTO inmediatamente. La cultura es lo único que no se puede arreglar con código. Asumo el caos técnico temporal para salvar el equipo.;emotional_stability 15 | leadership 20 | risk_propensity 10 | culture 20;"Mantengo al CTO pero lo aíslo. Le creo un puesto de ""Chief Architect"" sin gente a su cargo, trabajando solo desde casa. Retengo su cerebro pero protejo al equipo.";diplomacy 15 | pragmatism 15 | conflict_avoidance 10 | innovation 5;Intento mediar una última vez. Contrato un coach ejecutivo para el CTO y le doy 30 días de prueba. Perder su talento técnico sería un suicidio ahora mismo.;optimism 15 | patience 10 | risk_propensity -5 | dependence 10;"Me pongo del lado del CTO. En una startup de alto rendimiento necesitamos ""Navy Seals"", no gente que se ofenda fácil. Dejo que se vayan los juniors.";achievement 20 | ruthlessness 15 | empathy -20 | elitism 10
TECH;5;La Ética del Crecimiento;"El crecimiento de usuarios se ha estancado. Tu Head of Growth ha desarrollado un ""bot"" que extrae emails de LinkedIn masivamente y los inscribe en vuestra newsletter sin permiso. Es ilegal (GDPR), pero las pruebas dicen que duplicaría vuestra base de usuarios en un mes. Los inversores piden crecimiento ya.";Doy luz verde al bot. En la guerra y en las startups, la velocidad justifica los medios. Ya pediremos perdón o pagaremos la multa cuando seamos gigantes.;mischievous 20 | risk_propensity 20 | ethics -15 | ambition 15;Lo prohíbo terminantemente. La reputación de la marca es sagrada y no quiero construir un unicornio sobre cimientos de spam. Creceremos lento pero legal.;integrity 25 | diligent 15 | risk_propensity -10 | patience 10;"Busco un punto medio ""gris"". Usamos los datos para hacer campañas de retargeting en redes sociales (menos intrusivo) en lugar de spam directo al email.";astute 15 | creativity 10 | risk_propensity 5 | negotiation 5;"Subcontrato a una agencia externa que ""garantiza leads"" sin preguntar cómo lo hacen. Si hay problemas legales, la culpa será suya, no nuestra.";machiavellian 20 | risk_avoidance 10 | responsibility -10 | cunning 15
TECH;6;Colapso en Black Friday;Es Black Friday. El tráfico se dispara x10. La base de datos colapsa y la web se cae. Estás perdiendo 1.000€ por minuto. Twitter arde con clientes furiosos. Tu equipo técnico está en pánico, bloqueado y mirándote con terror. No tienes solución técnica inmediata.;Tomo el mando autocrático. Entro en la sala de servidores (o Zoom), asigno tareas cortas y precisas a gritos si es necesario para desbloquear la parálisis. Acción pura.;leadership 20 | assertiveness 15 | emotional_stability 5 | action 10;Mantengo la calma zen. Les traigo comida, les digo que respiren y que prioricen recuperar solo el proceso de pago, ignorando el resto. Transmito seguridad.;emotional_stability 25 | support 15 | self_efficacy 10 | resilience 10;Salgo a dar la cara públicamente. Grabo un video sincero explicando que hemos muerto de éxito y ofreciendo descuentos futuros. Gano tiempo con transparencia.;communication 20 | honesty 15 | image 10 | risk_propensity 5;Llamo de urgencia a una consultora de sistemas de élite para que nos rescaten, pagando una tarifa de urgencia desorbitada. Reconozco que esto nos supera.;humility 15 | delegation 10 | resourcefulness 10 | cost 10
TECH;7;La Oferta de Compra (Exit);"Google (o un gigante similar) te llama. Ofrecen 10 Millones de euros por tu startup. Te quedarían 4M€ limpios a ti. Es la libertad financiera de por vida. Pero sabes que su intención es cerrar tu producto y quedarse solo con los ingenieros (""Acqui-hire""). Tu sueño de cambiar el mundo muere si vendes.";Vendo. La estadística dice que el 90% de startups fracasan. Aseguro mi futuro y el de mi familia. Con 4M€ podré fundar otra cosa después con calma.;security 20 | realism 15 | ambition -5 | pragmatism 15;Rechazo la oferta. Valemos mucho más y tengo una misión que cumplir. No he llegado hasta aquí para ser un empleado de Google. Vamos a por los 100M€.;ambition 25 | risk_propensity 20 | tenacity 15 | idealism 10;"Intento negociar una venta parcial o una cláusula de permanencia del producto, sabiendo que eso podría hacer que retiren la oferta por ser ""problemático"".";negotiation 15 | attachment 10 | risk_propensity 5 | hope 5;Pido el doble (20M€) para poner a prueba su interés. Si pagan esa locura, vendo. Si no, sigo. Juego al póker con mi futuro.;gambler 20 | strategy 10 | emotional_stability 10 | greed 10
TECH;8;Deuda Técnica vs Venta;"Para cerrar un contrato vital con una multinacional, exigen una funcionalidad compleja para la semana que viene. Tu equipo dice que es imposible hacerla bien: habría que hacer una ""chapuza"" (hardcode) que desestabilizará todo el sistema en 3 meses. Si no aceptas, pierdes el contrato y el bonus anual.";Ordeno hacer la chapuza. La prioridad es cerrar la venta y asegurar la caja. Ya nos preocuparemos de arreglar el código (refactorizar) el trimestre que viene.;short_term 20 | achievement 15 | risk_propensity 10 | diligence -10;Rechazo la exigencia. La integridad del producto es lo primero. Si el cliente no puede esperar a que se desarrolle bien, no es el cliente adecuado.;long_term 20 | diligence 15 | assertiveness 10 | sales_loss 10;"Vendo la funcionalidad como un ""desarrollo a medida"" aparte, cobrando 5 veces más para contratar a un equipo externo que lo haga sin tocar nuestro núcleo.";business_acumen 20 | innovativeness 10 | flexibility 10 | delegation 5;Prometo que estará lista (mintiendo) para firmar el contrato, y luego pongo excusas técnicas para retrasar la entrega mientras lo desarrollamos bien.;mischievous 20 | deceit 15 | risk_propensity 10 | persuasion 10
TECH;9;El Gigante te Copia;Te despiertas con la noticia: Amazon acaba de lanzar un producto idéntico al tuyo. Es gratis y está integrado en su ecosistema Prime. Tus inversores te llaman en pánico preguntando qué vas a hacer. Tu producto cuesta 10€/mes.;Pivoto a un nicho ultra-específico donde Amazon no pueda entrar por ser demasiado generalista. Nos convertimos en la herramienta para expertos, no para masas.;adaptability 25 | strategy 20 | innovativeness 10 | resilience 10;Mantengo el rumbo. Nuestra ventaja es la atención al cliente y la comunidad, cosas que Amazon no tiene. Ignoro el ruido y sigo ejecutando el plan.;self_efficacy 20 | focus 15 | emotional_stability 10 | stubbornness 5;"Inicio una campaña de PR agresiva: ""David contra Goliat"". Denuncio sus prácticas monopólicas y apelo a la ética de los usuarios para que nos apoyen.";fighting_spirit 20 | communication 15 | external_locus 5 | risk_propensity 10;Busco fusionarme con otro competidor mediano. Solos no podemos sobrevivir, pero juntos quizás tengamos volumen suficiente para resistir.;collaboration 20 | pragmatism 15 | independence -10 | survival 10
TECH;10;La Mentira Piadosa;Tienes que enviar el reporte mensual a los inversores. Las métricas clave (retención) han caído, pero los registros han subido por una campaña de pago. Si muestras la retención real, podrían congelar la siguiente ronda de financiación que necesitas para pagar nóminas.;"Maquillo el informe. Destaco los registros en verde gigante y omito/escondo la gráfica de retención en un anexo confuso. ""Fake it till you make it"".";mischievous 25 | risk_propensity 15 | transparency -20 | survival 10;Envío los datos reales con un análisis brutalmente honesto de por qué fallamos y un plan de acción detallado para corregirlo en 30 días.;integrity 25 | responsibility 20 | courage 15 | diligence 10;Cambio la forma de calcular la métrica (de retención diaria a mensual) para que el gráfico parezca positivo sin mentir técnicamente.;astute 20 | rationalization 15 | creativity 10 | ethics -5;"Retraso el envío del informe con excusas técnicas (""problemas con la migración de datos"") esperando tener mejores números la semana que viene.";procrastination 15 | fear 10 | hope 5 | avoidance 10
TECH;11;Guerra Remota;"Tu equipo de desarrollo, tras la pandemia, exige trabajar 100% en remoto desde cualquier lugar. Tú sientes que la innovación se ha frenado y que falta ""roce"" y pizarra. Quieres volver a la oficina (híbrido), pero amenazan con irse a la competencia si les obligas.";Impongo el modelo híbrido (3 días oficina). La cultura y la creatividad son innegociables. Si se van, contrataré a gente que valore el contacto humano.;assertiveness 20 | conviction 15 | risk_propensity 10 | flexibility -10;"Cedo totalmente. Nos convertimos en ""Remote First"". Ahorro en oficinas y accedo a talento global, aunque tenga que aprender a gestionar asíncronamente.";adaptability 25 | pragmatism 15 | trust 10 | openness 10;Contrato solo a juniors locales para la oficina y mantengo a los seniors en remoto, creando dos niveles de empleados (aunque genere resentimiento).;strategy 15 | compromise 10 | inequality 5 | management 10;Instalo software de monitorización para asegurar la productividad remota, permitiendo el teletrabajo pero bajo vigilancia estricta.;distrust 20 | control 15 | culture -15 | anxiety 10
TECH;12;La Nómina o el Crédito;Final de mes. El cliente grande se ha retrasado en el pago. Faltan 20.000€ para cubrir las nóminas. El banco no te da crédito a la empresa porque ya estás al límite. Tienes ahorros personales para tu futura casa, pero si los pones, podrías perderlos.;Pongo mis ahorros personales. Mi equipo come antes que yo. Es mi responsabilidad como fundador y creo en el proyecto lo suficiente para doblar la apuesta.;commitment 25 | self_sacrifice 20 | risk_propensity 15 | leadership 10;Reúno al equipo, explico la situación con transparencia y les pido que esperen 15 días a cobrar, ofreciendo un bonus o stock options por las molestias.;communication 20 | trust 15 | vulnerability 10 | negotiation 5;Dejo de pagar a proveedores y a la Seguridad Social este mes (con recargo) para pagar las nóminas netas. Priorizo al equipo frente al Estado.;prioritization 15 | risk_propensity 10 | compliance -10 | loyalty 10;Despido a las 2 personas menos productivas hoy mismo para reducir la carga salarial y poder pagar al resto. Es una decisión de supervivencia.;ruthlessness 20 | decision_making 15 | empathy -10 | pragmatism 10
TECH;13;El Síndrome del Objeto Brillante;"Estáis desarrollando un SaaS de logística aburrido pero útil. De repente, la IA Generativa explota. Todo el equipo quiere dejar lo que hace y ""meter IA"" al producto, aunque no tenga mucho sentido. Sientes que perdéis el foco, pero temes parecer obsoleto.";"Mantengo el rumbo fijo. ""Somos logística, no ciencia ficción"". Prohíbo distracciones y exijo terminar el roadmap actual antes de mirar cosas nuevas.";discipline 25 | focus 20 | rigidity 10 | risk_aversion 5;Pivoto parcialmente. Dedico un 20% del tiempo del equipo a explorar cómo la IA puede mejorar nuestro producto real, canalizando el entusiasmo sin romper el foco.;balance 20 | leadership 15 | innovativeness 10 | flexibility 10;"Lanzo una ""feature"" de IA falsa (marketing) o muy básica solo para parecer modernos ante inversores, sin cambiar el producto real.";image 15 | superficiality 10 | mischievous 5 | astute 10;Nos volcamos en la IA. Si la tecnología cambia, nosotros también. Paralizo el desarrollo actual para integrar modelos de lenguaje en todo.;impulsiveness 20 | risk_propensity 20 | innovativeness 15 | stability -10
TECH;14;Unit Economics Negativos;"Te das cuenta de que pierdes 5€ por cada cliente que captas. Los inversores dicen que ""ya rentabilizaremos cuando tengamos escala"". Tú sientes que estás cavando un agujero cada vez más hondo. Tienes dinero para aguantar 6 meses así.";Cambio el modelo de negocio hoy. Subo precios o recorto costes drásticamente. Prefiero tener 10 clientes rentables que 1.000 que me arruinan.;financial_literacy 25 | realism 20 | courage 15 | growth -10;"Sigo acelerando. Confío en que la ""economía de escala"" y la viralidad bajarán los costes de captación a futuro. Es el juego de Venture Capital.";optimism 15 | risk_propensity 20 | faith 10 | denial 5;Busco formas de monetizar los datos de los usuarios o añadir publicidad para cubrir ese déficit, aunque empeore la experiencia de usuario.;creativity 15 | pragmatism 10 | user_experience -5 | resourcefulness 10;Preparo la empresa para una venta rápida (Exit) antes de que el mercado se dé cuenta de que los números no cuadran a largo plazo.;cunning 20 | detachment 15 | strategy 10 | ethics -5
TECH;15;Chantaje Digital;"Un hacker ""ético"" te escribe. Ha encontrado un agujero de seguridad brutal en tu web por donde se ven datos de usuarios. Pide 10.000€ en Bitcoin para decirte cómo cerrarlo y no hacerlo público. Legalmente no deberías pagar, pero si se filtra, es el fin.";Pago los 10.000€. Es un chantaje, pero el coste de una filtración pública es la muerte de la empresa. Lo soluciono en silencio y paso página.;pragmatism 20 | risk_avoidance 15 | secrecy 10 | compliance -5;No negocio con terroristas. Cierro la web temporalmente, contrato expertos para encontrar el fallo y denuncio al hacker a la policía, asumiendo el riesgo de filtración.;integrity 25 | principles 20 | risk_propensity 15 | courage 10;Intento contratar al hacker. Le ofrezco un puesto de trabajo y un bonus de bienvenida si nos ayuda a blindar el sistema. Transformo la amenaza en recurso.;astute 20 | innovativeness 15 | open_minded 10 | risk 10;Ignoro el mensaje y rezo para que sea un farol, mientras pongo a mi equipo a revisar el código frenéticamente.;denial 15 | passivity 10 | fear 10 | hope 5
TECH;16;Amigos y Negocios;Tu co-fundador y mejor amigo está rindiendo muy por debajo de lo necesario. El equipo lo nota y te pide que hagas algo. Él está pasando por un divorcio complicado y está depresivo. La empresa está en un momento crítico de ejecución.;Le aparto de la operativa temporalmente. Le doy una baja pagada para que se recupere, asumiendo yo su carga de trabajo. La amistad va antes que el negocio.;loyalty 25 | empathy 20 | workload 15 | business_risk 10;"Tengo la ""charla difícil"". Le digo que si no puede rendir al 100% ahora mismo, debe dar un paso al lado o reducir su participación (equity). El negocio no espera.";assertiveness 20 | professionalism 15 | emotional_stability 10 | friendship_risk 15;Le cubro las espaldas ante el equipo, inventando excusas sobre su trabajo estratégico. Intento ganar tiempo esperando que se recupere pronto.;protection 15 | deceit 5 | conflict_avoidance 10 | hope 5;Propongo vender la empresa o buscar un CEO externo. Si mi socio no funciona, el proyecto original ya no tiene sentido para mí.;dependency 20 | surrender 10 | attachment 15
TECH;17;Burnout del Fundador;Llevas 2 años trabajando 14 horas al día. Tienes ansiedad, insomnio y tu pareja te ha dado un ultimátum. La empresa va bien, pero tú sientes que vas a colapsar. Acaba de entrar una ronda de inversión y esperan que aceleres.;Contrato a un COO (Director de Operaciones) potente para delegar el día a día, aunque me cueste mucho dinero y tenga que ceder poder de decisión.;delegation 25 | humility 20 | self_preservation 15 | trust 10;Sigo empujando. El éxito requiere sacrificio. Tomo suplementos, voy a terapia y le pido paciencia a mi pareja. No puedo frenar ahora que tenemos gasolina.;resilience 20 | ambition 15 | stubbornness 10 | health_risk 20;Me tomo un mes sabático repentino. Dejo al equipo al mando y desaparezco a la montaña. Si la empresa no sobrevive un mes sin mí, es que no vale nada.;detachment 15 | trust 10 | risk_propensity 15 | self_care 20;Vendo mi parte en secundario a los inversores y me salgo. La salud mental es lo primero, prefiero ser un ex-fundador vivo que un CEO rico y enfermo.;radical_decision 20 | prioritization 25 | resignation 10
TECH;18;La Zona Gris Legal;Vuestra nueva funcionalidad bordea la legalidad (tipo Uber o Airbnb al principio). Los abogados dicen que hay un 50% de riesgo de multa millonaria, pero si funciona, seréis líderes indiscutibles del mercado.;"Lanzamos. ""Pedir perdón es mejor que pedir permiso"". Innovar siempre implica pisar líneas rojas. Asumimos el riesgo y guardamos dinero para multas.";risk_propensity 25 | innovativeness 20 | rebellion 15 | compliance -10;No lanzamos hasta tener seguridad jurídica. Adaptamos el producto para que sea 100% legal, aunque sea menos atractivo y más lento de usar.;prudence 25 | diligence 20 | fear 10 | growth -10;"Hacemos lobby. Me reúno con políticos y reguladores para intentar cambiar la norma antes de lanzar, o conseguir un ""sandbox"" de pruebas.";diplomacy 20 | influence 15 | patience 10 | strategy 10;Lanzamos a través de una sociedad filial o en un mercado extranjero con leyes laxas para probar sin contaminar la empresa matriz.;astute 20 | structure 15 | risk_mitigation 10
TECH;19;Guerra de Reviews;Un competidor ha organizado un ataque de bots para poner cientos de reseñas de 1 estrella en vuestra App Store, hundiendo vuestra media. Las ventas caen en picado. Apple/Google tardan semanas en responder.;Respondo públicamente con datos, exponiendo el ataque y pidiendo a nuestra comunidad real que nos apoye con reviews de 5 estrellas. Guerra abierta.;transparency 20 | community 15 | fighting_spirit 15 | conflict 10;"Compro 500 reviews falsas positivas para contrarrestar. ""Fuego contra fuego"". Es una medida de supervivencia sucia pero necesaria.";mischievous 25 | ethics -20 | survival 15 | risk_propensity 10;Espero a la resolución oficial de la plataforma. No entro en el juego sucio ni molesto a mis usuarios. Confío en el sistema.;patience 20 | compliance 15 | passivity 10 | trust 5;Cambio el nombre de la App o lanzo una nueva ficha (rebranding) para empezar de cero, abandonando la marca dañada.;adaptability 15 | evasion 10 | resilience -5 | cost 10
TECH;20;Talento vs Lealtad;Tu Ingeniero Principal, que lleva contigo desde el garaje, se ha quedado técnicamente obsoleto. La empresa ha crecido y su código es un lastre. Has encontrado a una candidata externa brillante que podría arreglarlo todo, pero tendrías que despedir a tu leal ingeniero.;Le despido con una indemnización generosa y una carta de recomendación increíble. La empresa necesita otro perfil y mi deber es con el futuro, no con el pasado.;professionalism 25 | ruthlessness 10 | clarity 15 | loyalty -10;Le mantengo por lealtad, pero contrato a la experta como su jefa. Espero que él acepte el rol secundario o se vaya por su cuenta.;loyalty 20 | conflict_avoidance 15 | hope 10 | management_risk 15;Le ofrezco un puesto diferente (Gestión, Cultura, Formación) donde no toque código crítico. Intento reciclarlo dentro de la casa.;empathy 20 | loyalty 15 | creativity 10 | cost 5;No contrato a la experta. Prefiero pagarle cursos de formación a mi ingeniero actual y darle tiempo para ponerse al día. Invierto en él.;development 20 | patience 15 | risk_propensity 5 | speed -10
TECH;21;El Ego del Fundador;"Te han dado un premio prestigioso ""30 under 30"". Te invitan a conferencias y fiestas. Empiezas a pasar más tiempo en eventos de networking y marca personal que en la oficina. El equipo empieza a hacer bromas sarcásticas sobre tu ""fama"".";Corto de raíz la agenda pública. Cancelo charlas y vuelvo a sentarme con el equipo a trabajar. El mejor marketing es un buen producto, no mi cara.;humility 25 | focus 20 | discipline 15 | image -10;"Aprovecho el tirón. Mi marca personal atrae inversores y talento. Delega el trabajo operativo y asumo el rol de ""Embajador"" de la empresa a tiempo completo.";delegation 20 | vision 15 | ego 10 | detachment 5;Intento llevarme al equipo a los eventos y darles protagonismo a ellos en las entrevistas para repartir el mérito y calmar los ánimos.;leadership 20 | empathy 15 | diplomacy 10 | balance 5;Ignoro las críticas. Son celos. Mi trabajo ha evolucionado y ellos no entienden que las relaciones públicas son trabajo real.;arrogance 20 | denial 10 | conflict 5 | self_efficacy 10
TECH;22;Código Abierto (Open Source);"Vuestro producto usa una librería de código abierto mantenida por voluntarios. Habéis construido una mejora propietaria increíble sobre ella. La comunidad os pide que la liberéis. Si lo hacéis, perdéis vuestra ventaja competitiva. Si no, quedáis como unos ""aprovechados"".";No liberamos nada. Somos una empresa, no una ONG. Nuestra propiedad intelectual (IP) es lo que nos da valor y protege los sueldos.;protectionism 25 | business_focus 20 | community -10 | capitalism 15;Liberamos el código. Creemos en el karma y en que la comunidad mejorará nuestro código aún más. Nuestra ventaja debe ser la ejecución, no el secreto.;altruism 20 | confidence 15 | openness 20 | risk_propensity 10;"Liberamos una versión ""Lite"" o antigua de la mejora, guardándonos la parte ""Premium"" para nosotros. Una solución política para quedar bien.";strategy 20 | negotiation 15 | astuteness 10 | compromise 5;Patrocinamos económicamente a los mantenedores de la librería original con donaciones mensuales para compensar nuestra falta de contribución de código.;diplomacy 15 | guilt_management 10 | resourcefulness 5
