SECTOR;MES;TITULO;NARRATIVA;OPCION_A_TXT;OPCION_A_LOGIC;OPCION_B_TXT;OPCION_B_LOGIC;OPCION_C_TXT;OPCION_C_LOGIC;OPCION_D_TXT;OPCION_D_LOGIC
PYME;14;El Banco Cierra el Grifo;"El banco te comunica que te cancela la póliza de crédito de repente por ""cambio de política de riesgos"". Te quedas sin liquidez operativa mañana. Tienes pedidos firmados pero no dinero para comprar material.";Busco financiación alternativa urgente (Fintech, Crowdlending, Prestamistas) aunque sea mucho más cara. El dinero es la sangre del negocio, pago lo que sea por él.;resourcefulness 25 | speed 20 | cost 15 | survival 10;"Pido anticipos a los clientes. Les explico la verdad y les pido ayuda. ""Si queréis el producto, pagad por adelantado"". Transparencia radical y confianza.";vulnerability 20 | negotiation 15 | trust 10 | risk 5;Vendo activos personales o de la empresa (furgoneta, local) malvendidos para conseguir cash hoy. Liquido patrimonio para seguir operando. Quemo las naves.;sacrifice 20 | commitment 15 | loss 10 | desperation 5;Reduzco la empresa al tamaño que pueda financiar con mi caja real. Cancelo pedidos y despido gente. Si tengo que hacerme pequeño, me hago pequeño.;realism 25 | humility 20 | safety 15 | ambition -10
PYME;15;El Ciberataque (Ransomware);Un virus ha encriptado todos los archivos de tu servidor. Te piden 5.000€ en Bitcoin para recuperarlos. No tienes copias de seguridad recientes (error tuyo). Toda la contabilidad, clientes y pedidos están ahí. Estás ciego.;Pago el rescate. Es un error mío y 5.000€ es barato comparado con perderlo todo y cerrar. Trago saliva, pago a los criminales y rezo para que cumplan.;pragmatism 25 | humility 20 | solution 15 | ethics -10;No pago. Llamo a informáticos para intentar recuperar lo que sea y reconstruyo el resto a mano con facturas en papel y memoria. Trabajo de chinos, pero digno.;resilience 20 | integrity 15 | effort 10 | principle 10;Denuncio a la policía y me siento a esperar. Me paralizo esperando que la autoridad me resuelva el problema (spoiler: no lo harán a tiempo).;dependency 20 | passivity 15 | hope 10 | bureaucracy 5;"Cierro la empresa y abro otra nueva limpia. Aprovecho el desastre para hacer ""borrón y cuenta nueva"" fiscal y laboral. Huida hacia adelante.";opportunism 20 | cynicism 15 | escape 10 | ethics -15
PYME;16;El Empleado Conflictivo pero Bueno;"Tienes un empleado que trabaja muy bien y saca mucha faena, pero es un ""mal bicho"". Critica a la empresa por detrás, desmotiva a los compañeros y crea mal ambiente constante.";Le despido. Una manzana podrida estropea el cesto. El rendimiento individual no compensa el daño colectivo a la cultura. Higiene mental para todos.;culture 25 | leadership 20 | courage 15 | short_term_loss 10;Le aguanto porque saca el trabajo adelante y me cuesta dinero despedirle. Miro para otro lado y le aíslo de los demás para que no contamine.;tolerance 20 | pragmatism 15 | conflict_avoidance 10 | morale -10;"Hablo con él e intento ""convertirle"". Creo que puedo cambiar su actitud con cariño, coaching y liderazgo. Síndrome del salvador.";optimism 20 | patience 15 | ego 10 | time_waste 5;Le promociono para darle más responsabilidad, pensando que si se siente importante dejará de criticar. (Estrategia arriesgada de cooptación).;risk 20 | psychology 10 | hope 5 | naive 5
PYME;17;Contratar al Hijo del Dueño;"Tu hijo acaba de terminar los estudios y quiere entrar en la empresa. No está preparado, no tiene actitud y quiere ser jefe, pero tu pareja te presiona. Es ""su derecho"" como heredero.";"Le digo que no. ""Vete a trabajar fuera 5 años, aprende, equivócate, y luego hablamos"". La empresa se respeta y no es una guardería. Meritocracia.";integrity 25 | tough_love 20 | professionalism 15 | family_conflict 10;"Le meto en el almacén a cargar cajas a las 6:00 AM. ""Aquí se empieza desde abajo"". Si sobrevive a la realidad, servirá. Si no, se irá él solo.";discipline 20 | tradition 15 | test 10 | fairness 5;"Le creo un puesto de ""Adjunto a Dirección"" con buen sueldo y coche. Es mi hijo, esto es para él y la sangre tira más que el negocio.";nepotism 20 | family 15 | unfairness 10 | culture -15;Le contrato pero le pongo bajo las órdenes del encargado más duro y exigente que tengo, pidiéndole que no tenga piedad con él.;delegation 20 | strategy 15 | conflict_avoidance 10 | hope 5
PYME;18;La Burocracia de la Calidad;Un cliente grande te exige tener la certificación ISO 9001. Implantarla es un infierno de papeles, procedimientos y un coste de 6.000€, y sabes que no mejorará tu producto real, solo es burocracia.;Lo hago. Es el peaje para jugar en las grandes ligas. Me tapo la nariz, pago, relleno los papeles y consigo el sello. Es una inversión comercial necesaria.;pragmatism 25 | adaptability 20 | compliance 15 | cost 10;No lo hago. Mi calidad está en el producto, no en un sello de papel. Si el cliente no lo ve, que se vaya. Resistencia a la burocracia inútil.;authenticity 25 | stubbornness 20 | savings 10 | opportunity_loss 10;"Busco una certificadora ""barata"" que me de el sello sin mirar mucho. Cumplo el trámite (tick the box) con el mínimo esfuerzo y coste.";mischievous 20 | efficiency 15 | superficiality 10 | ethics -5;Intento convencer al cliente de que mis controles internos son mejores que la ISO y le invito a auditarme él mismo. Trato de negociar la exigencia.;negotiation 20 | confidence 15 | communication 10 | risk 5
PYME;19;El Defecto Oculto;Has fabricado 1.000 unidades con un defecto estético menor (el logo está un poco torcido). Funcionan perfecto. El cliente no lo ha notado aún y las ha recibido. Si te callas, cobras. Si lo dices, pierdes dinero.;Aviso al cliente, le cuento el defecto y le ofrezco un descuento del 20% si se las queda, o repetirlas gratis. Honestidad proactiva para ganar confianza.;integrity 25 | transparency 20 | trust 15 | cost 10;"Me callo. Si se queja, diré que no me di cuenta y actuaré sorprendido. ""Si cuela, cuela"". El defecto es mínimo y necesito cobrar.";risk_propensity 20 | deceit 15 | saving 10 | reputation_risk 15;Las recojo todas y las repito sin que el cliente se entere. Mi marca no entrega basura. El coste de repetirlo es menor que el coste de imagen.;perfectionism 25 | standards 20 | loss 15 | pride 10;Intento venderlas a otro cliente menos exigente (outlet/saldo) y fabrico nuevas para el principal. Recupero parte del coste con astucia.;resourcefulness 20 | agility 15 | sales 10 | efficiency 5
PYME;20;La Amenaza de Amazon;Vendes en tu tienda física y local. Amazon te ofrece vender tus productos en su Marketplace. Llegarás a todo el mundo, pero te cobrarán comisiones altas, te copiarán los datos y perderás el contacto directo con el cliente.;Entro en Amazon. Es donde está la gente. Si no estoy ahí, no existo. Acepto sus reglas leoninas para conseguir volumen y facturación.;adaptability 25 | growth 20 | realism 15 | margin -10;No entro. Amazon es el enemigo del comercio local. Me mantengo fiel a mi canal y mi web propia. Resistencia numantina y defensa de mi margen.;independence 25 | ideology 20 | control 15 | isolation 10;Entro en Amazon solo con productos gancho baratos para atraer gente, y pongo un flyer en la caja para llevarlos a mi web propia. Uso al enemigo.;strategy 25 | cunning 20 | marketing 15 | intelligence 10;Creo una segunda marca solo para Amazon para no canibalizar mis precios ni mi marca principal. Juego a dos bandas protegiendo mi identidad.;segmentation 20 | resourcefulness 15 | protection 10 | work 10
PYME;21;El Socio Cansado;Sois dos socios al 50%. Tu socio se ha cansado, ya no tiene ilusión y quiere vender su parte e irse a vivir al campo. Tú no tienes dinero para comprarle su mitad, pero no quieres un socio nuevo desconocido.;Me endeudo hasta las cejas con el banco para comprarle su parte. Apuesto doble por la empresa. Prefiero la deuda a tener un socio extraño.;risk_propensity 25 | ownership 20 | ambition 15 | financial_stress 10;Buscamos juntos a un tercero que compre su parte, asumiendo que tendré que entenderme con un desconocido. Cedo control por tranquilidad financiera.;pragmatism 20 | flexibility 15 | uncertainty 10 | partnership 5;"Le convenzo para que se quede como socio ""silencioso"", sin trabajar pero cobrando dividendos. Cargo con todo el trabajo yo, pero mantengo el control.";negotiation 20 | workload 15 | autonomy 10 | unfairness 5;Vendemos la empresa entera. Si él se va, yo también. El proyecto era de los dos. Cierro una etapa y busco algo nuevo.;detachment 20 | loyalty 15 | exit 10 | restart 5
PYME;22;El Comercial Estrella;Tienes un comercial que vende muchísimo (trae el 40% de la facturación), pero es un mercenario. Te pide comisiones cada vez más altas y amenaza con irse a la competencia con su cartera de clientes si no cedes.;Cedo y le pago lo que pide. Soy rehén de sus ventas. Sin él, la empresa se hunde. Compro tiempo y paz con margen.;submission 20 | dependency 15 | fear 10 | profit -10;Le dejo ir. Nadie es imprescindible. Asumo el golpe de perder ventas a corto plazo y me pongo yo a vender para reconstruir la cartera. Independencia.;courage 25 | resilience 20 | autonomy 15 | sales 10;Contrato a dos comerciales junior para que aprendan de él (o le copien los contactos) y reducir mi dependencia poco a poco. Plan de sustitución.;strategy 20 | planning 15 | management 10 | cunning 5;Le ofrezco acciones de la empresa para vincularle a largo plazo y que deje de pensar como mercenario. Le hago socio (esposas de oro).;negotiation 15 | partnership 10 | dilution 5 | retention 10
PYME;23;Multa de Inspección de Trabajo;Has tenido una inspección y te han puesto una multa de 6.000€ por un tema de prevención de riesgos (un papel que faltaba). Es injusto y recurrible, pero el recurso cuesta dinero y tiempo. Si pagas pronto, es la mitad.;Pago con descuento (3.000€) y me olvido. Me da rabia, pero mi tiempo vale más que mi razón. Pragmatismo puro y a otra cosa.;pragmatism 25 | efficiency 20 | acceptance 15 | cost 5;Recurro la multa hasta el final. Es una injusticia y no voy a regalar dinero a la administración por un papel. Cuestión de principios.;justice 20 | tenacity 15 | principles 10 | time_waste 5;Busco al gestor que tenía que haber hecho ese papel y le exijo que pague él la multa o le demando por negligencia profesional.;assertiveness 20 | external_locus 15 | conflict 10 | money 5;"Lloro y pataleo en la oficina, amargando a todo el mundo por la ""injusticia del sistema"", pero al final pago tarde y mal.";excitable 20 | victimization 15 | inefficiency 10 | anger 5
PYME;24;Crisis de Reputación Local;Ha salido un rumor en el pueblo de que tu empresa va a cerrar o que no paga a proveedores (es falso). Los clientes empiezan a preguntar y los proveedores te cortan el crédito. El rumor te está matando.;Hago una jornada de puertas abiertas o una fiesta para clientes y proveedores. Muestro músculo, sonrisas y normalidad. Mato el rumor con hechos.;transparency 25 | marketing 20 | resilience 15 | social 10;Emito un comunicado oficial serio desmintiendo los rumores y amenazando con acciones legales a quien los difunda. Defensa corporativa.;formalism 20 | defense 15 | legal 10 | aggression 5;Voy uno a uno hablando con los proveedores clave para enseñarles mis cuentas y tranquilizarles. Trabajo de hormiga en la sombra.;diligence 20 | trust 15 | communication 10 | effort 5;"No hago nada. ""A palabras necias, oídos sordos"". Espero que el rumor muera solo. Riesgo de que la bola de nieve crezca.";passivity 20 | stoicism 15 | risk 10 | denial 5
PYME;25;El Local en Propiedad;Llevas 10 años de alquiler. El dueño del local quiere venderlo. Te ofrece comprárselo por 200.000€. Si no, lo vende a otro y te pueden echar. Hipotecarte te ata al negocio para siempre.;Lo compro. Es mi seguridad. Me hipoteco a 20 años pero dejo de tirar dinero en alquiler. Echo raíces definitivas.;commitment 25 | stability 20 | investment 15 | risk_aversion 10;No compro. Busco otro local de alquiler y me mudo. Prefiero la libertad de poder cerrar o moverme si el negocio va mal. Flexibilidad.;freedom 25 | flexibility 20 | risk_propensity 10 | change 10;Negocio un contrato de alquiler nuevo a largo plazo (15 años) con el nuevo dueño para asegurar mi posición sin comprar. Solución legal.;negotiation 20 | security 15 | smart 10 | balance 5;Compro el local a nombre de una sociedad patrimonial personal (no de la empresa) para separar el ladrillo del riesgo del negocio.;strategy 25 | financial_literacy 20 | protection 15 | wealth 10
PYME;26;Obsolescencia del Producto;Fabricas algo que se está dejando de usar (ej: agendas de papel). Las ventas caen un 5% cada año. Tienes un negocio rentable hoy, pero muerto mañana. ¿Cuándo saltas?;Ahora. Invierto los beneficios de hoy en crear una línea de negocio totalmente nueva y digital. Canibalizo mi propio negocio antes de que muera.;innovativeness 25 | vision 20 | courage 15 | reinvention 10;Aguanto hasta el final. Reduzco costes y exprimo la vaca mientras dé leche. Seré el último fabricante de agendas y me quedaré el nicho residual.;conservatism 20 | efficiency 15 | niche 10 | decline 5;"Intento ""modernizar"" el producto viejo (agendas con QR). Un híbrido que no suele funcionar pero que da sensación de cambio.";denial 15 | superficiality 10 | hope 5 | fear 5;Vendo la empresa a un competidor incauto que quiera cuota de mercado, antes de que los números bajen más. Salida a tiempo.;exit 25 | timing 20 | smart 15 | detachment 10
PYME;27;El Asesor Externo;"Te sientes estancado. Un consultor te ofrece un plan de ""Reestructuración y Crecimiento"" por 10.000€. Te promete que doblarás facturación. Te parece mucho dinero por ""consejos"".";Le contrato. Necesito una mirada externa y profesional. Yo solo no sé salir de aquí. Es una inversión en conocimiento.;humility 25 | growth_mindset 20 | trust 15 | investment 10;"No le contrato. ""Nadie conoce mi negocio mejor que yo"". Los consultores venden humo. Me compro libros y aprendo yo.";self_efficacy 25 | skepticism 20 | frugality 15 | arrogance 5;Le contrato solo para un diagnóstico inicial barato (1.000€) y ya decidiré si implanto yo las medidas. Pruebo antes de comprar.;prudence 20 | control 15 | negotiation 10 | smart 5;Busco un mentor gratis (empresario jubilado, asociación) que me ayude por altruismo. Busco sabiduría sin coste.;resourcefulness 20 | networking 15 | savings 10 | social 5
PYME;28;Vacaciones del Equipo;Es verano. Todo el mundo quiere vacaciones en Agosto. Si se las das a todos, tienes que cerrar la empresa un mes y no facturas. Si no, hay peleas por las fechas.;Cierro en Agosto. Todo el mundo descansa a la vez. Ahorro costes operativos y evito peleas. Asumo la pérdida de facturación como coste estructural.;peace 20 | simplicity 15 | culture 10 | profit -10;"No cierro. Establezco turnos rotatorios obligatorios. ""El negocio no para"". Alguien tiene que pringar en Agosto. Priorizo el servicio al cliente.";service 25 | discipline 20 | authority 15 | conflict 10;"Dejo que se organicen ellos. ""Tenéis que cubrir el servicio, arreglaos entre vosotros"". Les paso la patata caliente de la gestión.";delegation 15 | trust 10 | chaos 10 | leadership -5;Ofrezco un bonus económico a quien quiera trabajar en Agosto voluntariamente para cubrir el servicio. Incentivo con dinero.;market 20 | flexibility 15 | fairness 10 | cost 5
PYME;29;La Marca Blanca;"Un gran distribuidor te ofrece fabricar tu producto para su ""Marca Blanca"". Mucho volumen, margen ridículo y desaparece tu logo. Te convertirías en su fábrica.";Acepto. Lleno la fábrica y aseguro los costes fijos. El volumen me da tranquilidad aunque pierda identidad. Soy industrial, no marquista.;security 20 | pragmatism 15 | scale 10 | anonymity 5;Rechazo. Quiero defender mi marca y mi margen. No quiero ser esclavo de un solo cliente que me puede apretar cuando quiera. Independencia.;autonomy 25 | pride 20 | brand 15 | risk 10;Acepto pero uso una línea de producción vieja o sobrante para ellos, protegiendo mi capacidad principal para mi marca. Juego a dos bandas.;strategy 20 | capacity 15 | smart 10 | balance 5;Les ofrezco fabricar un producto diferente (peor calidad) para que no compita con el mío en el lineal. Diferenciación.;segmentation 20 | negotiation 15 | protection 10 | astuteness 5
PYME;30;El Accidente Laboral;"Un empleado se ha cortado un dedo en una máquina porque quitó la protección de seguridad ""para ir más rápido"". La inspección de trabajo va a venir. Tienes miedo.";"Digo la verdad: ""El empleado quitó la protección bajo su responsabilidad"". Tengo los cursos de formación firmados. Me defiendo legalmente.";justice 20 | legal 15 | firmness 10 | conflict 5;Intento llegar a un acuerdo con el empleado para que no denuncie, pagándole una indemnización extraoficial. Compro su silencio.;corruption 20 | fear 15 | negotiation 10 | risk 10;Reviso todas las máquinas de la fábrica esa noche y pongo protecciones nuevas antes de que venga el inspector. Maquillo la escena.;deceit 20 | reaction 15 | panic 10 | ethics -10;Asumo la culpa como empresa por no vigilar lo suficiente. Pago la multa y mejoro los protocolos. Liderazgo responsable extremo.;responsibility 25 | integrity 20 | improvement 15 | cost 10
PYME;31;Sucesión Familiar;"Tienes 55 años. Tu hija trabaja contigo y lo hace bien, pero tu hijo (que estaba fuera) quiere volver y ""dirigir"". Tu hija se siente desplazada. Conflicto sucesorio.";Apoyo a mi hija. Ella se lo ha ganado trabajando aquí años. La meritocracia está por encima del género o la primogenitura. Me enfrento a mi hijo.;justice 25 | meritocracy 20 | courage 15 | family_conflict 10;"Intento ponerles a los dos de co-directores. ""Hermanos unidos"". Busco una paz artificial que seguramente acabe en guerra civil.";naivety 20 | avoidance 15 | harmony 10 | disaster 5;Contrato a un profesional externo para que dirija y dejo a mis hijos en el Consejo de Administración. Saco a la familia de la gestión diaria.;professionalisation 25 | wisdom 20 | objectivity 15 | cost 10;"No decido nada. ""Ya se arreglarán cuando yo falte"". Dejo el problema para el futuro. Cobardía paterna.";procrastination 20 | fear 15 | weakness 10 | legacy -10
PYME;32;La Crisis de los 40 (de la empresa);Tu empresa lleva 15 años haciendo lo mismo. Es rentable pero aburrida. Tú estás aburrido. Todo funciona por inercia. Sientes que te mueres en vida.;Monto una nueva línea de negocio radicalmente distinta dentro de la empresa para volver a sentir la adrenalina. Intraemprendimiento.;innovativeness 25 | passion 20 | risk 15 | renewal 10;Me compro un coche deportivo y me dedico a jugar al golf, dejando que la empresa funcione sola. Disfruto de lo conseguido. El rey vago.;hedonism 20 | detachment 15 | comfort 10 | stagnation 5;Vendo la empresa y monto una startup desde cero. Necesito volver a la casilla de salida. Soy emprendedor, no gestor.;restart 25 | risk_propensity 20 | identity 15 | action 10;Ficho talento joven para que revolucionen la empresa ellos, mientras yo les mentorizo. Transfiero mi energía a la siguiente generación.;generosity 20 | leadership 15 | revitalization 10 | delegation 5
PYME;33;El Chantaje del Casero;"Se acaba tu contrato de alquiler del local. El dueño sabe que te va bien y te quiere subir el precio un 50%. ""Si no te gusta, te vas"". Tienes toda tu clientela ahí.";Me voy. No acepto chantajes. Busco un local cercano y hago una campaña agresiva para mover a mis clientes. Asumo el coste del traslado.;autonomy 25 | courage 20 | resilience 15 | disruption 10;Pago la subida. El coste de traslado y pérdida de clientes es mayor que la subida. Soy cautivo de mi ubicación. Trago y pago.;pragmatism 20 | calculation 15 | submission 10 | stability 5;Negocio una subida escalonada a 5 años a cambio de reformas en el local. Intento buscar un Win-Win dentro de la extorsión.;negotiation 20 | strategy 15 | patience 10 | balance 5;Busco trapos sucios del local o del dueño para presionarle a la baja. Juego sucio defensivo.;cunning 20 | aggression 15 | conflict 10 | risk 5
PYME;34;Subvenciones;"Ha salido una subvención europea para ""Digitalización Sostenible"". Te dan 10.000€ a fondo perdido. No tienes pensado hacer nada de eso, pero el dinero es gratis.";"Pido la subvención y me invento un proyecto para justificarla. ""Hay que coger el dinero que cae del cielo"". Caza-subvenciones.";opportunism 25 | greed 20 | bureaucracy 15 | ethics -5;No la pido. El tiempo que pierdo en papeles vale más que 10.000€. Me centro en vender a clientes, no en pedir al Estado. Foco.;focus 25 | efficiency 20 | independence 15 | realism 10;Pido la subvención y aprovecho para hacer una reforma real que tenía pendiente, adaptándola a los requisitos. Aprovecho la oportunidad.;smart 20 | investment 15 | alignment 10 | utility 5;Contrato a una consultora que me la gestione a cambio de un % de éxito. Externalizo el dolor burocrático.;delegation 20 | comfort 15 | cost 10 | ease 5
PYME;35;Proveedor Local vs Global;Compras materia prima a un proveedor local del pueblo (caro) para apoyar la economía de la zona. Un proveedor internacional te ofrece lo mismo un 30% más barato.;Cambio al internacional. Tengo que ser competitivo. Si no cuido mi margen, cerraré yo y no podré ayudar a nadie. El mercado es global.;business 25 | efficiency 20 | profit 15 | coldness 10;"Sigo con el local. Mi marca es ""Kilómetro Cero"" y apoyo a mi comunidad. Eso es parte de mi valor y mi historia. Coherencia.";values 25 | community 20 | loyalty 15 | margin -5;Presiono al local con la oferta del internacional para que baje precios. Le obligo a ser más eficiente. Tracción de la cadena.;negotiation 20 | pressure 15 | improvement 10 | tension 5;Compro el 80% al barato y el 20% al local para mantener la relación y la imagen. Hipocresía táctica.;strategy 20 | balance 15 | appearance 10 | cunning 5
PYME;36;El Cliente Político;El Ayuntamiento te ofrece un contrato a dedo (sin concurso) porque conoces al concejal. Es mucho dinero, pero huele a favoritismo. Si cambia el gobierno, te quedarás fuera.;"Lo cojo. ""Aprovecha la racha"". El dinero público también vale. Facturo todo lo que pueda mientras dure mi contacto.";opportunism 25 | risk 20 | profit 15 | politics 10;No lo cojo. No quiero que me etiqueten políticamente ni depender de favores. Quiero clientes privados que me compren por mi calidad.;independence 25 | integrity 20 | long_term 15 | prudence 10;Lo cojo pero hago el trabajo de forma impecable y a precio de mercado, para que nadie pueda decir nada. Intento hacerlo ético.;justification 20 | confidence 15 | work 10 | risk 5;"Le pido que lo saquen a concurso público para presentarme legalmente y ganarlo ""limpiamente"" (sabiendo que tengo ventaja).";legal 20 | appearance 15 | strategy 10 | ethics 5
PYME;37;Delegar la Caja;Sigues siendo el único que toca el dinero y las cuentas bancarias. No te fías de nadie. Eso te obliga a estar siempre disponible para pagar cualquier cosa.;Delego la gestión financiera en un administrativo o el gerente. Pongo controles, pero suelto la llave de la caja. Confianza operativa.;delegation 25 | trust 20 | freedom 15 | risk 10;"Sigo controlando yo cada euro. ""El ojo del amo engorda el caballo"". Nadie cuidará mi dinero como yo. Esclavitud voluntaria.";control 25 | distrust 20 | fear 15 | inefficiency 10;Automatizo pagos y cobros con el banco para tener que intervenir lo mínimo posible, pero sin dar acceso a personas. Tecnología.;efficiency 20 | modernization 15 | control 10 | smart 5;Le doy firma mancomunada (necesita dos firmas) a mi socio/pareja para no estar solo, pero manteniendo seguridad.;prudence 20 | sharing 15 | safety 10 | balance 5
PYME;38;Redes Sociales;"No tienes redes sociales. ""Eso es para niños"". Tus clientes te dicen que no te encuentran en Instagram. Sientes que te estás volviendo invisible.";Contrato a un Community Manager profesional. No sé hacerlo, así que pago a alguien que sepa. Inversión en visibilidad.;investment 25 | delegation 20 | adaptation 15 | modernity 10;"Me abro la cuenta y subo fotos cutres yo mismo. ""Mejor hecho que perfecto"". Lo intento con mis medios.";effort 20 | learning 15 | resourcefulness 10 | quality_risk 5;Sigo sin redes. Si mi producto es bueno, el boca a boca funciona. Me niego a entrar en la rueda del postureo.;stubbornness 25 | tradition 20 | independence 15 | invisibility 10;Le pido a mi sobrino que me lo lleve gratis. Solución chapucera típica de PYME.;nepotism 20 | cheapness 15 | amateur 10 | hope 5
PYME;39;Formación del Dueño;Hace 20 años que no estudias nada. Sientes que el mundo empresarial te supera (IA, Marketing Digital, Finanzas).;Me apunto a un programa de dirección para empresarios (caro y exigente). Vuelvo a la escuela. Humildad para aprender.;growth_mindset 25 | humility 20 | effort 15 | investment 10;"No estudio. ""La universidad de la vida es la mejor"". Mi experiencia vale más que cualquier teoría. Arrogancia del superviviente.";arrogance 25 | stagnation 20 | denial 15 | comfort 10;Leo libros y veo vídeos de YouTube por las noches. Autoformación barata y a mi ritmo.;autodidact 20 | curiosity 15 | frugality 10 | discipline 5;Contrato a gente que sepa de eso para que lo hagan ellos. Yo no necesito saber, necesito dirigir.;delegation 20 | pragmatism 15 | management 10 | detachment 5
